Product URL,Product Name,Product Price,Rating,Number of reviews,Description,ASIN,Product Description,Manufacturer
https://amazon.com/gp/slredirect/picassoRedirect.html/ref=pa_sp_mtf_aps_sr_pg2_1?ie=UTF8&adId=A10221032GPA211CUPX2T&qualifier=1685105799&id=6088538247207848&widgetName=sp_mtf&url=%2FMerchandise-Business-Boutique-Shopping-Wrapping%2Fdp%2FB099F3T4DH%2Fref%3Dsr_1_114_sspa%3Fcrid%3D2M096C61O4MLT%26keywords%3Dbags%26qid%3D1685105799%26sprefix%3Dba%252Caps%252C283%26sr%3D8-114-spons%26psc%3D1,"ysmile Small Merchandise Bag for Small Business Boutique Plastic Shopping Bag Store Retail Bag Die Cut Poly Bag with Handle Goods 100 ct 5.9""x7.8"" Extra Thick 2.5 Mil - Blue",$11.99,4.7 out of 5 stars,199 ratings,"Ysmile Boutique Thick Plastic Merchandise Bag Die Cut Design with HanldeProduct Color : Black/White/Pink/Silver/Purple/BlueProduct Size :5.9""x7.8""/7.8""x11.8""/11.8""x15.8""Product Density :2.5 MilProduct Quantity : 100 ctOur merchandise bag is made of High quality HDPE, the density is average and very thick, not like others, it would wrap your goods perfectly, when you use it, it is quiet, no noise, you can use it for your small business, or gift package, store retail bag is a good choice, building your brand from now, give your customer a good impression.",,"Ysmile Boutique Thick Plastic Merchandise Bag Die Cut Design with HanldeProduct Color : Black/White/Pink/Silver/Purple/BlueProduct Size :5.9""x7.8""/7.8""x11.8""/11.8""x15.8""Product Density :2.5 MilProduct Quantity : 100 ctOur merchandise bag is made of High quality HDPE, the density is average and very thick, not like others, it would wrap your goods perfectly, when you use it, it is quiet, no noise, you can use it for your small business, or gift package, store retail bag is a good choice, building your brand from now, give your customer a good impression.",
https://amazon.com/32-Packs-Handles-Different-Multiple-Uses%EF%BC%88Small/dp/B09XC9NQRY/ref=sr_1_115?crid=2M096C61O4MLT&keywords=bags&qid=1685105799&sprefix=ba%2Caps%2C283&sr=8-115,"32-Packs Paper Bags with Handles Bulk 8.26""×6""×3.15"" Small Gift Bags 16 Different Senior Color Bags Multiple Uses（Small Size）",$16.88,4.6 out of 5 stars,343 ratings,,B09XC9NQRY,,
https://amazon.com/Coleman-Sleeping-Brazos-Cold-Weather-Camping/dp/B00363V3OK/ref=sr_1_116?crid=2M096C61O4MLT&keywords=bags&qid=1685105799&sprefix=ba%2Caps%2C283&sr=8-116,"Coleman Brazos Cold-Weather Sleeping Bag, 20°F/30°F Lightweight Camping Sleeping Bag for Adults, No-Snag Zipper with Stuff Sack Included, Machine Washable",$39.99,4.6 out of 5 stars,"9,671 ratings","Product Description   Stay warm and cozy on cold nights under the stars in temperatures as low as 20°F when you add the Coleman Cold-Weather 20°F Brazos Sleeping Bag to your camping gear. It's built to last season after season thanks to a durable construction that keeps insulation from shifting.   Amazon.com   Nothing is as crucial to a successful camping trip as a good night's sleep, and the Coleman Brazos Cold-Weather sleeping bag will keep you cozy down to 20 degrees Fahrenheit. The bag measures 33 by 75 inches (W x D), and fits most campers up to five feet, eleven inches tall. Durably constructed of a stain-resistant polyester outer with soft tricot liner, the Brazos holds four pounds of proprietary ColeTherm insulation. A QuickCord system makes for easy packing and storage, with no tying required.  Completely machine washable, this sleeping bag includes Coleman's ComfortSmart technology, meaning it's full of features to keep you warm and comfortable, such as: ZipPlow: Prevents zipper snags by plowing fabric away from zipper Roll Control: Locks bag in place for easier rolling FiberLock: Prevents insulation from shifting, increasing durability ThermoLock: Reduces heat loss through the zipper, keeping you warmer Certified Temperature Rating: Independently tested for temperature accuracy Zipper Glide Tailoring: Allows smooth zipper operation around the corner Comfort Cuff: Surrounds your face with softness The Coleman Limited Warranty All Coleman products have a warranty against defects in material and workmanship, and the Brazos Cold-Weather Sleeping Bag includes a limited five-year manufacturer's warranty. About Coleman Outdoor Products More than 100 years ago, an entrepreneurial young man named W.C. Coleman had an idea for manufacturing better lanterns in Wichita, Kansas. A century later, Coleman's current catalog features a wide-ranging array of products that make spending time outside a pleasure. The company crafts coolers that keep food and drinks cold for days, airbeds that are comfortable and won't deflate during the night, a complete line of bright and long-lasting LED lights, powerful portable grills that cook with an authentic open-grill flame, and more.",B00363V3OK,"Product Description   Stay warm and cozy on cold nights under the stars in temperatures as low as 20°F when you add the Coleman Cold-Weather 20°F Brazos Sleeping Bag to your camping gear. It's built to last season after season thanks to a durable construction that keeps insulation from shifting.   Amazon.com   Nothing is as crucial to a successful camping trip as a good night's sleep, and the Coleman Brazos Cold-Weather sleeping bag will keep you cozy down to 20 degrees Fahrenheit. The bag measures 33 by 75 inches (W x D), and fits most campers up to five feet, eleven inches tall. Durably constructed of a stain-resistant polyester outer with soft tricot liner, the Brazos holds four pounds of proprietary ColeTherm insulation. A QuickCord system makes for easy packing and storage, with no tying required.  Completely machine washable, this sleeping bag includes Coleman's ComfortSmart technology, meaning it's full of features to keep you warm and comfortable, such as: ZipPlow: Prevents zipper snags by plowing fabric away from zipper Roll Control: Locks bag in place for easier rolling FiberLock: Prevents insulation from shifting, increasing durability ThermoLock: Reduces heat loss through the zipper, keeping you warmer Certified Temperature Rating: Independently tested for temperature accuracy Zipper Glide Tailoring: Allows smooth zipper operation around the corner Comfort Cuff: Surrounds your face with softness The Coleman Limited Warranty All Coleman products have a warranty against defects in material and workmanship, and the Brazos Cold-Weather Sleeping Bag includes a limited five-year manufacturer's warranty. About Coleman Outdoor Products More than 100 years ago, an entrepreneurial young man named W.C. Coleman had an idea for manufacturing better lanterns in Wichita, Kansas. A century later, Coleman's current catalog features a wide-ranging array of products that make spending time outside a pleasure. The company crafts coolers that keep food and drinks cold for days, airbeds that are comfortable and won't deflate during the night, a complete line of bright and long-lasting LED lights, powerful portable grills that cook with an authentic open-grill flame, and more.",‎Coleman
https://amazon.com/Coobiiya-Insulated-Reusable-Leakproof-Cooler/dp/B0BQHKMZZ1/ref=sr_1_117?crid=2M096C61O4MLT&keywords=bags&qid=1685105799&sprefix=ba%2Caps%2C283&sr=8-117,"Coobiiya Lunch Bag Women, Insulated Lunch Box Tote Bag for Women Adult Men, Reusable Small Leakproof Cooler Cute Lunch Box Bags for Work Office Picnic or Travel(Black)",$9.98,4.7 out of 5 stars,739 ratings,,B0BQHKMZZ1,,Coobiiya
https://amazon.com/Computer-Briefcase-Waterproof-Professional-Shoulder/dp/B08JBRDFKY/ref=sr_1_118?crid=2M096C61O4MLT&keywords=bags&qid=1685105799&sprefix=ba%2Caps%2C283&sr=8-118,Laptop Bag for Women 15.6 inch Laptop Tote Bag Leather Classy Computer Briefcase for Work Waterproof Handbag Professional Shoulder Bag Women Business Office Bag Large Capacity Black,$33.99,4.5 out of 5 stars,"5,788 ratings",,‎B08JBRDFKY,,‎Lubardy
https://amazon.com/Hefty-Slider-Freezer-Bags-Gallon/dp/B01JLPJM7G/ref=sr_1_119?crid=2M096C61O4MLT&keywords=bags&qid=1685105799&sprefix=ba%2Caps%2C283&sr=8-119,"Hefty Slider Freezer Storage Bags, Gallon Size, 56 Count",$9.99,4.8 out of 5 stars,"35,255 ratings","Portion bulk foods for freezer storage, or package treats and leftovers for friends and family with gallon size Hefty Slider Freezer Bags. The thicker plastic and extra-strong seal helps keep food fresh and protected from freezer burn. The patented MaxLock track and Clicks-Closed feature lets you know when these BPA-free plastic freezer bags are securely closed. The stand-and-fill expandable bottom makes it easy to load food, craft supplies or other household items into these storage bags. Large write-on labels let you identify and organize the contents of each of these slider bags in your fridge, freezer or closet. Take these Hefty freezer bags with you on-the-go, too! Keep clothes fresh and wrinkle free in suitcases or keep camping supplies protected from mess. Don’t forget; Hefty's premium quality and super strength come with superior savings and a 100..",,"Portion bulk foods for freezer storage, or package treats and leftovers for friends and family with gallon size Hefty Slider Freezer Bags. The thicker plastic and extra-strong seal helps keep food fresh and protected from freezer burn. The patented MaxLock track and Clicks-Closed feature lets you know when these BPA-free plastic freezer bags are securely closed. The stand-and-fill expandable bottom makes it easy to load food, craft supplies or other household items into these storage bags. Large write-on labels let you identify and organize the contents of each of these slider bags in your fridge, freezer or closet. Take these Hefty freezer bags with you on-the-go, too! Keep clothes fresh and wrinkle free in suitcases or keep camping supplies protected from mess. Don’t forget; Hefty's premium quality and super strength come with superior savings and a 100..",
https://amazon.com/Targus-Laptop-Bag-Briefcase-Messenger/dp/B005G2YP6M/ref=sr_1_120?crid=2M096C61O4MLT&keywords=bags&qid=1685105799&sprefix=ba%2Caps%2C283&sr=8-120,"Targus Laptop Bag Classic Slim Briefcase Messenger Bag, Spacious, Ergonomic, Foam Padded Laptop Case for Devices",$22.00,4.7 out of 5 stars,"9,284 ratings",,,,
https://amazon.com/Wevac-Weston-Commercial-Puncture-Prevention/dp/B07TV5RNQL/ref=sr_1_121?crid=2M096C61O4MLT&keywords=bags&qid=1685105799&sprefix=ba%2Caps%2C283&sr=8-121,"Wevac Vacuum Sealer Bags 100 Quart 8x12 Inch for Food Saver, Seal a Meal, Weston. Commercial Grade, BPA Free, Heavy Duty, Great for vac storage, Meal Prep or Sous Vide",$17.99,4.7 out of 5 stars,"12,685 ratings","Wevac Vacuum Sealer bags and rollsWaste less, enjoy more!LOWER PRICES with GREATER VALUE Commercial Grade Rolls and Pre-cut Bags with inexpensive pricing. Bags and Rolls are EASY & CONVENIENT to use! Save more food so that you can enjoy life more.EASY to VACUUM and SEAL, HEAVY DUTYEmbossed Micro Channel design make it efficient for vacuuming and sealing Air and water proof material prevents leaking and freezer burnThe included Bone Guard can be used to prevent food from puncturing the vacuum bag. It is ideal for storing or sous vide cooking T-bone calves, denim bones, ribs, seafood with fishbone or shells, and more.SAFE and GREEN Prevent FREEZER BURN and DEHYDRATION.Perfect for Storage, Meal Prep and Sous Vide.Keep Freshness and Flavor in your foodExtend shelf-time 3-6 times longerWevac has 10 years experience of making professional vacuum sealer bags!Wevac bags are made in China to US quality standards.",B07TV5RNQL,"Wevac Vacuum Sealer bags and rollsWaste less, enjoy more!LOWER PRICES with GREATER VALUE Commercial Grade Rolls and Pre-cut Bags with inexpensive pricing. Bags and Rolls are EASY & CONVENIENT to use! Save more food so that you can enjoy life more.EASY to VACUUM and SEAL, HEAVY DUTYEmbossed Micro Channel design make it efficient for vacuuming and sealing Air and water proof material prevents leaking and freezer burnThe included Bone Guard can be used to prevent food from puncturing the vacuum bag. It is ideal for storing or sous vide cooking T-bone calves, denim bones, ribs, seafood with fishbone or shells, and more.SAFE and GREEN Prevent FREEZER BURN and DEHYDRATION.Perfect for Storage, Meal Prep and Sous Vide.Keep Freshness and Flavor in your foodExtend shelf-time 3-6 times longerWevac has 10 years experience of making professional vacuum sealer bags!Wevac bags are made in China to US quality standards.",
https://amazon.com/Plastic-Shopping-Boutique-Handles-Merchandise/dp/B08W3NF4BN/ref=sr_1_122?crid=2M096C61O4MLT&keywords=bags&qid=1685105799&sprefix=ba%2Caps%2C283&sr=8-122,"Purple Q Crafts Large Plastic Shopping Bags with Thank You Logo 16"" x 18"" Boutique Bags with Handles 100 Pack for Merchandise, Gifts, Trade Shows and More",$29.99,4.7 out of 5 stars,896 ratings,"Make your boutique unique with our gorgeous designer large boutique shopping bags! You will love the cute and classy design. You will love the strength and durability of these reusable plastic bags. You will love the versatility - use them for a pop up shops, craft sales, gift bags and more! They are the perfect size for packaging products such as clothing, gifts or shoes . Your customers will love bringing home their purchases in these plastic thank you bags. Try it out and you'll see!",,"Make your boutique unique with our gorgeous designer large boutique shopping bags! You will love the cute and classy design. You will love the strength and durability of these reusable plastic bags. You will love the versatility - use them for a pop up shops, craft sales, gift bags and more! They are the perfect size for packaging products such as clothing, gifts or shoes . Your customers will love bringing home their purchases in these plastic thank you bags. Try it out and you'll see!",
https://amazon.com/Amazon-Basics-Gallon-Trash-Bags/dp/B09NQGR39K/ref=sr_1_123?crid=2M096C61O4MLT&keywords=bags&qid=1685105799&sprefix=ba%2Caps%2C283&sr=8-123,"Amazon Basics 4 Gallon Trash Bags, Flap Ties with Fresh Scent, 80 Count",$7.93,4.5 out of 5 stars,23 ratings,"Amazon Basics Fresh Scent Flap Tie Trash Bags, 4 Gallon, 80 Count, This package contains 80 Amazon Basics flap tie, scented, 4 gallon trash bags, each 0.5 mil thick. Flap Tie Closure Makes it easy to seal and remove the small garbage bag",,"Amazon Basics Fresh Scent Flap Tie Trash Bags, 4 Gallon, 80 Count, This package contains 80 Amazon Basics flap tie, scented, 4 gallon trash bags, each 0.5 mil thick. Flap Tie Closure Makes it easy to seal and remove the small garbage bag",
https://amazon.com/Lenovo-Carrying-15-6-Inch-Water-Repellent-GX40Q17231/dp/B075Y73SDV/ref=sr_1_124?crid=2M096C61O4MLT&keywords=bags&qid=1685105799&sprefix=ba%2Caps%2C283&sr=8-124,"Lenovo Laptop Carrying Case T210, fits for 15.6-Inch Laptop and Tablet, Sleek Design, Durable and Water-Repellent Fabric, Business Casual or School, GX40Q17231 - Grey",$15.02,4.7 out of 5 stars,"6,897 ratings","The Lenovo 15.6-inch laptop shoulder bag T210 utilizes a water-repellent Fabric and a clean, streamlined design to create a case that's perfectly suited to modern life. It offers an integrated laptop compartment comfortably fits most laptop up to 15.6 inches, a range of internal pockets for those must-have accessories, and a spacious main compartment for books and other items.",,"The Lenovo 15.6-inch laptop shoulder bag T210 utilizes a water-repellent Fabric and a clean, streamlined design to create a case that's perfectly suited to modern life. It offers an integrated laptop compartment comfortably fits most laptop up to 15.6 inches, a range of internal pockets for those must-have accessories, and a spacious main compartment for books and other items.",
https://amazon.com/Aklyaiap-Resistant-gallon-Bags%EF%BC%8CBiodegradable-Kitchen%EF%BC%8C5Rolls/dp/B09Z82QMZF/ref=sr_1_125?crid=2M096C61O4MLT&keywords=bags&qid=1685105799&sprefix=ba%2Caps%2C283&sr=8-125,"220 Counts Aklyaiap 4 Gallon Trash Bag,Tear & Leak Resistant Bathroom Garbage Bags 4 gallon,White &Unscented Bathroom Trash Bags，Biodegradable Trash Bags Small Trash Can Bags for Home & Kitchen，5Rolls",$21.99,4.5 out of 5 stars,645 ratings,,B09Z82QMZF,,
https://amazon.com/Bonsenkitchen-Commercial-Textured-Embossed-Storage/dp/B0BLTXWFNQ/ref=sr_1_126?crid=2M096C61O4MLT&keywords=bags&qid=1685105799&sprefix=ba%2Caps%2C283&sr=8-126,"Bonsenkitchen Vacuum Food Sealer Bags 100 Quart 6"" x 10"", BPA Free, Commercial Grade Textured Food Vacuum Sealer Bag, Thick Embossed Bags for Food Storage and Sous Vide Cooking",$10.99,4.7 out of 5 stars,"1,057 ratings",,B0BLTXWFNQ,,
https://amazon.com/BagDream-16x6x12-Shopping-Mechandise-Recyclable/dp/B07R1HGJXP/ref=sr_1_127?crid=2M096C61O4MLT&keywords=bags&qid=1685105799&sprefix=ba%2Caps%2C283&sr=8-127,"BagDream 100Pcs 16x6x12 Inches Kraft Paper Bags with Handles Bulk Gift Bags Shopping Bags for Grocery, Merchandise, Party, 100% Recyclable Large Black Paper Bags",$59.99,4.7 out of 5 stars,402 ratings,,B07R1HGJXP,,BagDream
https://amazon.com/Carhartt-Legacy-Cross-Organizer-Brown/dp/B07GP999Z9/ref=sr_1_128?crid=2M096C61O4MLT&keywords=bags&qid=1685105799&sprefix=ba%2Caps%2C283&sr=8-128,"Carhartt Zip, Durable, Adjustable Crossbody Bag with Zipper Closure, Brown, One Size",$29.99,4.6 out of 5 stars,"1,772 ratings","The Earhart Legacy Cross Body Gear Organizer is perfect for carrying tools and other essentials. A compact sling bag, it features a roomy main compartment with two slash pockets and five elastic loops, perfect for small tools, hunting gear or other small items. The front compartment has a slash pocket and key fob so keys are never lost. Made from heavy duty poly with Rain Defended durable water repellent, it's up for rugged use. An adjustable shoulder strap makes it easy to carry gear across the body, keeping hands free for other tasks. The Earhart Legacy Cross body Gear Organizer measures 6w x 9h x 3.5d inches, weighs 0.5lb, and features a Earhart logo patch. Earhart Work Bags, Packs & Gear are covered by a limited warranty against manufacturing defects in materials and workmanship for the normal life of the product.",B07GP999Z9,"The Earhart Legacy Cross Body Gear Organizer is perfect for carrying tools and other essentials. A compact sling bag, it features a roomy main compartment with two slash pockets and five elastic loops, perfect for small tools, hunting gear or other small items. The front compartment has a slash pocket and key fob so keys are never lost. Made from heavy duty poly with Rain Defended durable water repellent, it's up for rugged use. An adjustable shoulder strap makes it easy to carry gear across the body, keeping hands free for other tasks. The Earhart Legacy Cross body Gear Organizer measures 6w x 9h x 3.5d inches, weighs 0.5lb, and features a Earhart logo patch. Earhart Work Bags, Packs & Gear are covered by a limited warranty against manufacturing defects in materials and workmanship for the normal life of the product.",Carhartt
https://amazon.com/Glad-Medium-Drawstring-Clorox-Package/dp/B08L4Q92QG/ref=sr_1_129?crid=2M096C61O4MLT&keywords=bags&qid=1685105799&sprefix=ba%2Caps%2C283&sr=8-129,"Glad Medium Drawstring Trash Bags with Clorox, 8 Gallon Grey Trash Bags, Lemon Fresh Bleach Scent, (Package May Vary), Lemon, 80 Count",$16.25,4.7 out of 5 stars,"5,593 ratings","Glad and Clorox have joined forces to create a trash bag with the strength of Glad and the odor-fighting power of Clorox. Glad with Clorox medium drawstring trash bags resists bacterial odors on the bag to keep your home feeling clean and healthy. These 8 gallon garbage bags fit medium Size trash cans and are Ideal for bathrooms, bedrooms, offices, nurseries and laundry rooms. Featuring a Grey bag and printed hexagon design around The hem of the bag, these trash bags add a design detail to any room when they are folded around the edge of the can. Just a quick cinch of the durable drawstring makes trash removal simple. These versatile trash bags feature the clean smell of lemon fresh bleach scent. Glad with Clorox garbage bags work as hard as you do to maintain a clean and healthy home with a versatile design FOR bins around the home.",,"Glad and Clorox have joined forces to create a trash bag with the strength of Glad and the odor-fighting power of Clorox. Glad with Clorox medium drawstring trash bags resists bacterial odors on the bag to keep your home feeling clean and healthy. These 8 gallon garbage bags fit medium Size trash cans and are Ideal for bathrooms, bedrooms, offices, nurseries and laundry rooms. Featuring a Grey bag and printed hexagon design around The hem of the bag, these trash bags add a design detail to any room when they are folded around the edge of the can. Just a quick cinch of the durable drawstring makes trash removal simple. These versatile trash bags feature the clean smell of lemon fresh bleach scent. Glad with Clorox garbage bags work as hard as you do to maintain a clean and healthy home with a versatile design FOR bins around the home.",
https://amazon.com/Pieces-Rainbow-Party-Handle-Assorted/dp/B07XNSCCLH/ref=sr_1_130?crid=2M096C61O4MLT&keywords=bags&qid=1685105799&sprefix=ba%2Caps%2C283&sr=8-130,30 Pieces Kraft Paper Rainbow Party Favor Bags with Handle Assorted Colors (Rainbow),$12.99,4.8 out of 5 stars,"1,889 ratings","30 Pieces Kraft Paper Rainbow Party Favor Bags with Handle Assorted Colors (Rainbow)Size: 8.66 x 6.3 x 3.15 inch environmental paper bag.5 bags for each color.Easy for standing up and carrying.These colorful gift bags are perfect for birthday treat bags, the goodie bag, party bags, gift bags, party favor bags, wedding bags, retail bags, and more..",,"30 Pieces Kraft Paper Rainbow Party Favor Bags with Handle Assorted Colors (Rainbow)Size: 8.66 x 6.3 x 3.15 inch environmental paper bag.5 bags for each color.Easy for standing up and carrying.These colorful gift bags are perfect for birthday treat bags, the goodie bag, party bags, gift bags, party favor bags, wedding bags, retail bags, and more..",
https://amazon.com/Kraft-Shopping-Bags-Handles-Reusable/dp/B07MQRV9W2/ref=sr_1_131?crid=2M096C61O4MLT&keywords=bags&qid=1685105799&sprefix=ba%2Caps%2C283&sr=8-131,"Qutuus 10x5x13 Kraft Paper Bags 100 Pcs Kraft Shopping Bags, Paper Gift Bags, Retail Bags, Recycled Bulk Paper Bags, Brown Paper Bags with Handles Bulk",$33.79,4.7 out of 5 stars,"1,012 ratings",,B07MQRV9W2,,
https://amazon.com/Lucky-Foldable-Overnight-Adjustable-Shoulder/dp/B0B3YC5G81/ref=sr_1_132?crid=2M096C61O4MLT&keywords=bags&qid=1685105799&sprefix=ba%2Caps%2C283&sr=8-132,"Lucky Travel Duffel Bags 65L, Gym Bag, Travel Bag & Large Duffle Bag for Men, Foldable Overnight Weekender Bags for Women & Men with Adjustable Shoulder Strap, Loden Green",$23.99,4.7 out of 5 stars,215 ratings,,B0B3YC5G81,,
https://amazon.com/Heavy-Duty-Gallon-Trash-Bags/dp/B07NFL7WS8/ref=sr_1_133?crid=2M096C61O4MLT&keywords=bags&qid=1685105799&sprefix=ba%2Caps%2C283&sr=8-133,"Aluf Plastics Heavy Duty 55 Gallon Trash Bags - (Value 50 Pack) - 1.5 MIL equivalent Industrial Strength Plastic 35"" x 55"" for 50-55 Gal Cans -Fits Toter, Rubbermaid Brute, Carlislie Bronco etc.",$20.42,4.5 out of 5 stars,"4,469 ratings","Aluf Plastics Heavy Duty 55 Gallon Trash Bags - (Value 50 Pack) - 1.5 MIL equivalent Industrial Strength Plastic 35"" x 55"" for 50-55 Gal Cans -Fits Toter, Rubbermaid Brute, Carlislie Bronco etc.",,"Aluf Plastics Heavy Duty 55 Gallon Trash Bags - (Value 50 Pack) - 1.5 MIL equivalent Industrial Strength Plastic 35"" x 55"" for 50-55 Gal Cans -Fits Toter, Rubbermaid Brute, Carlislie Bronco etc.",
https://amazon.com/Pack-Thank-Plastic-Bags-Bulk/dp/B09MF88MLT/ref=sr_1_134?crid=2M096C61O4MLT&keywords=bags&qid=1685105799&sprefix=ba%2Caps%2C283&sr=8-134,"400 Pack Thank You Plastic Bags Bulk - Premium Quality 15 Mic (0.6 Mil) Thick Grocery Bags - Reusable Plastic Bags For Small Business - Take Out Plastic Bags For Food - 11.5"" X 6.5"" X 21"" T-Shirt Bags",$24.90,4.7 out of 5 stars,429 ratings,"Get Yourself A Pack of Premium Quality Multi-Purpose Thank You Plastic Bags By Pinnacle Supply – Starting Today!Add value to your customers shopping experience with these premium quality Thank you Plastic bags that all your customers & guests will love!Sturdy & ConvenientPinnacle supply offers high quality, sturdy, and convenient plastic bags that makes carrying your items easy. These plastic bags are high quality, and more sturdy than standard grocery store bags.Bold Thank You DesignOur premium plastic bags have a bold and beautiful Thank You design that'll leave your customers and guests feeling highly appreciated for patronizing your business. You can't go wrong with these plastic bags. Perfect SizeWith a large pack of 400 bags at a great price, you'll have more than enough to use for any purpose. Each bag is a perfect size, measuring 11.5"" X 6.5"" X 21""Order Your Own Large Pack Of Premium Quality Plastic Bags By Pinnacle Supply Now – Before Our Supplies Run Out!",B09MF88MLT,"Get Yourself A Pack of Premium Quality Multi-Purpose Thank You Plastic Bags By Pinnacle Supply – Starting Today!Add value to your customers shopping experience with these premium quality Thank you Plastic bags that all your customers & guests will love!Sturdy & ConvenientPinnacle supply offers high quality, sturdy, and convenient plastic bags that makes carrying your items easy. These plastic bags are high quality, and more sturdy than standard grocery store bags.Bold Thank You DesignOur premium plastic bags have a bold and beautiful Thank You design that'll leave your customers and guests feeling highly appreciated for patronizing your business. You can't go wrong with these plastic bags. Perfect SizeWith a large pack of 400 bags at a great price, you'll have more than enough to use for any purpose. Each bag is a perfect size, measuring 11.5"" X 6.5"" X 21""Order Your Own Large Pack Of Premium Quality Plastic Bags By Pinnacle Supply Now – Before Our Supplies Run Out!",
