Product URL,Product Name,Product Price,Rating,Number of reviews,Description,ASIN,Product Description,Manufacturer
https://amazon.com/gp/slredirect/picassoRedirect.html/ref=pa_sp_mtf_aps_sr_pg3_1?ie=UTF8&adId=A10100802GHH5DFCA9R5O&qualifier=1685106285&id=1768212028676818&widgetName=sp_mtf&url=%2FUMT-Plastar-Biodegradable-Thickness-Environmentally%2Fdp%2FB09NN8WR62%2Fref%3Dsr_1_122_sspa%3Fcrid%3D2M096C61O4MLT%26keywords%3Dbags%26qid%3D1685106285%26sprefix%3Dba%252Caps%252C283%26sr%3D8-122-spons%26psc%3D1,"UMT Plastar 50-Pack Large Biodegradable White Plastic Bags with 24"" H x 18"" W Size and 50 Micron Thickness for Retail, Gifts, Parties, and Events. Featuring a Delicate Clematis Pattern and ""Thank You"" Message, these bags are both Environmentally Friendly and Reusable",$31.99,5.0 out of 5 stars,5 ratings,"Introducing UMT Plastar, the high-quality and eco-friendly packaging solution for your retail merchandise, gifts, parties, events, and small businesses. These bags are made from thick and durable 50mic plastic material, ensuring their strength and reliability as a shopping bag.Not only are they strong and reliable, but they are also degradable and can break down over time, making them a sustainable choice for your business. With their classic white color and versatile design, they are perfect for a variety of occasions, including gift-giving, boutique shopping, and more.One of the unique features of UMT Plastar is their ability to be reused and recycled, making them an eco-friendly choice that can help reduce your ecological footprint. These bags are perfect for small businesses, event planners, and anyone who cares about the environment and wants to make a positive impact.Order now and experience the quality and reliability of UMT Plastar bags for yourself. Your customers will love the convenience and style they provide, and you can feel good knowing that you are making a difference in protecting the planet.",B09NN8WR62,"Introducing UMT Plastar, the high-quality and eco-friendly packaging solution for your retail merchandise, gifts, parties, events, and small businesses. These bags are made from thick and durable 50mic plastic material, ensuring their strength and reliability as a shopping bag.Not only are they strong and reliable, but they are also degradable and can break down over time, making them a sustainable choice for your business. With their classic white color and versatile design, they are perfect for a variety of occasions, including gift-giving, boutique shopping, and more.One of the unique features of UMT Plastar is their ability to be reused and recycled, making them an eco-friendly choice that can help reduce your ecological footprint. These bags are perfect for small businesses, event planners, and anyone who cares about the environment and wants to make a positive impact.Order now and experience the quality and reliability of UMT Plastar bags for yourself. Your customers will love the convenience and style they provide, and you can feel good knowing that you are making a difference in protecting the planet.",
https://amazon.com/gp/slredirect/picassoRedirect.html/ref=pa_sp_mtf_aps_sr_pg3_1?ie=UTF8&adId=A05098911QZ7MOI1WA3S1&qualifier=1685106285&id=1768212028676818&widgetName=sp_mtf&url=%2FLuggage-Adjustable-Suitcases-Silicone-Hands-Free%2Fdp%2FB0BX2VFGQ2%2Fref%3Dsr_1_123_sspa%3Fcrid%3D2M096C61O4MLT%26keywords%3Dbags%26qid%3D1685106285%26sprefix%3Dba%252Caps%252C283%26sr%3D8-123-spons%26psc%3D1,"2-in-1 Luggage Straps Travel Belt for Luggage Over Handle for Carry On Bag, Adjustable Elastic Luggage Straps for Suitcases Add a Bag, 2 x Silicone Luggage Tags, Hands-Free for Trip & Airport",$19.99,4.7 out of 5 stars,17 ratings,"What's in the box: 1x travel luggage strap, 2x silicone luggage tags, and instruction manual.Size information: The minimum length of the travel luggage strap is 28 inches, and it can be extended up to 59 inches in length. The width is 2 inches.",B0BX2VFGQ2,"What's in the box: 1x travel luggage strap, 2x silicone luggage tags, and instruction manual.Size information: The minimum length of the travel luggage strap is 28 inches, and it can be extended up to 59 inches in length. The width is 2 inches.",‎bjcpxwk
https://amazon.com/gp/slredirect/picassoRedirect.html/ref=pa_sp_mtf_aps_sr_pg3_1?ie=UTF8&adId=A07547154Y3HQ41YCFI&qualifier=1685106285&id=1768212028676818&widgetName=sp_mtf&url=%2FWeekender-Overnight-Compartment-Oversized-Business%2Fdp%2FB0BKL8285Z%2Fref%3Dsr_1_124_sspa%3Fcrid%3D2M096C61O4MLT%26keywords%3Dbags%26qid%3D1685106285%26sprefix%3Dba%252Caps%252C283%26sr%3D8-124-spons%26psc%3D1,"Travel Weekender Bag for Women Overnight Bag with Shoe Compartment Oversized Travel Duffel Bag Carry On Tote with Trolley Sleeve 21"" for Weekend Travel Business Trip",$58.99,4.4 out of 5 stars,"1,518 ratings",,,,
https://amazon.com/Ziploc-Storage-Quart-Bags-Count/dp/B019ZTZTVQ/ref=sr_1_125?crid=2M096C61O4MLT&keywords=bags&qid=1685106285&sprefix=ba%2Caps%2C283&sr=8-125,"Ziploc Quart Food Storage Bags, Grip 'n Seal Technology for Easier Grip, Open, and Close, 80 Count",$10.99,4.8 out of 5 stars,"18,257 ratings","Ziploc brand Medium Storage Bags (quart) are a great way to lock in flavor and safely store and transport fresh food, snacks and other items thanks to durable plastic and Grip ‘n Seal technology.",,"Ziploc brand Medium Storage Bags (quart) are a great way to lock in flavor and safely store and transport fresh food, snacks and other items thanks to durable plastic and Grip ‘n Seal technology.",
https://amazon.com/Glad-ForceFlex-Kitchen-Drawstring-Unscented/dp/B087NN1L8W/ref=sr_1_126?crid=2M096C61O4MLT&keywords=bags&qid=1685106285&sprefix=ba%2Caps%2C283&sr=8-126,"GLAD ForceFlex Tall Drawstring Trash Bags, 13 Gallon White Trash Bags for Tall Kitchen Trash Can, Unscented Leak Protection Bags, 120 Count - Packaging May Vary",$20.98,4.7 out of 5 stars,"55,281 ratings","Keep your trash contained with the durability and quality of Glad. Glad tall kitchen drawstring trash bags are designed with force Flex Technology to give extra flex as it expands around sharp Edges and heavy loads, so you can pack It in without ripping. These dual-layered trash bags feature Lifeguard and Leak Guard technology to resist punctures, rips and tears, and the seepage of liquids. Let the stretchable strength of Glad handle all the messes our busy daily life can throw at it and then some. The durable grips-the-can drawstring ensures that the bag stays in place, and provides a sturdy 3-ply handle making it easy to lift, carry, and toss the bag. Tough and resilient, Glad can handle some abuse, so shake the trash deeper into the bag while keeping everything contained. Take on trash with the Confidence of Glad.",,"Keep your trash contained with the durability and quality of Glad. Glad tall kitchen drawstring trash bags are designed with force Flex Technology to give extra flex as it expands around sharp Edges and heavy loads, so you can pack It in without ripping. These dual-layered trash bags feature Lifeguard and Leak Guard technology to resist punctures, rips and tears, and the seepage of liquids. Let the stretchable strength of Glad handle all the messes our busy daily life can throw at it and then some. The durable grips-the-can drawstring ensures that the bag stays in place, and provides a sturdy 3-ply handle making it easy to lift, carry, and toss the bag. Tough and resilient, Glad can handle some abuse, so shake the trash deeper into the bag while keeping everything contained. Take on trash with the Confidence of Glad.",
https://amazon.com/Shrink-Pak-Clothing-Bedding-Resuable-Vacuum/dp/B092375SBL/ref=sr_1_127?crid=2M096C61O4MLT&keywords=bags&qid=1685106285&sprefix=ba%2Caps%2C283&sr=8-127,"Hefty Shrink-Pak - 3 Extra Large Vacuum Storage Bags for Storage for Clothes, Pillows, Towels, or Blankets - Space Saver Vacuum Sealer Bags Ideal Under Bed Storage Solutions",$15.99,4.1 out of 5 stars,831 ratings,,B092375SBL,,
https://amazon.com/Drawsting-Bag-Bulk-48-Pieces-Drawstring-Backpacks-Colors/dp/B08BXNJTHG/ref=sr_1_128?crid=2M096C61O4MLT&keywords=bags&qid=1685106285&sprefix=ba%2Caps%2C283&sr=8-128,GoodtoU Drawstring Bags Bulk 48 Pcs Drawstring Backpack Bulk String Backpack Draw String Bags Pack Cinch Bags for Gym,$34.99,4.7 out of 5 stars,"1,654 ratings",,,,
https://amazon.com/Lenovo-Carrying-15-6-Inch-Water-Repellent-GX40Q17231/dp/B075Y73SDV/ref=sr_1_129?crid=2M096C61O4MLT&keywords=bags&qid=1685106285&sprefix=ba%2Caps%2C283&sr=8-129,"Lenovo Laptop Carrying Case T210, fits for 15.6-Inch Laptop and Tablet, Sleek Design, Durable and Water-Repellent Fabric, Business Casual or School, GX40Q17231 - Grey",$15.02,4.7 out of 5 stars,"6,897 ratings","The Lenovo 15.6-inch laptop shoulder bag T210 utilizes a water-repellent Fabric and a clean, streamlined design to create a case that's perfectly suited to modern life. It offers an integrated laptop compartment comfortably fits most laptop up to 15.6 inches, a range of internal pockets for those must-have accessories, and a spacious main compartment for books and other items.",,"The Lenovo 15.6-inch laptop shoulder bag T210 utilizes a water-repellent Fabric and a clean, streamlined design to create a case that's perfectly suited to modern life. It offers an integrated laptop compartment comfortably fits most laptop up to 15.6 inches, a range of internal pockets for those must-have accessories, and a spacious main compartment for books and other items.",
https://amazon.com/Amazon-Basics-Freezer-Quart-Count/dp/B093WNNDLD/ref=sr_1_130?crid=2M096C61O4MLT&keywords=bags&qid=1685106285&sprefix=ba%2Caps%2C283&sr=8-130,"Amazon Basics Freezer Quart Bags, 120 Count (Previously Solimo)",$9.32,4.7 out of 5 stars,"46,608 ratings","Product Description   Amazon Basics Freezer Quart Bags, 120 Count, Reclosable top has a double zipper closure. Stand and Fill base with same quart capacity   From the Manufacturer   Amazon Basics",B093WNNDLD,"Product Description   Amazon Basics Freezer Quart Bags, 120 Count, Reclosable top has a double zipper closure. Stand and Fill base with same quart capacity   From the Manufacturer   Amazon Basics",
https://amazon.com/Shopping-Christmas-Birthday-Restaurant-Business/dp/B0B2PG5KJ3/ref=sr_1_131?crid=2M096C61O4MLT&keywords=bags&qid=1685106285&sprefix=ba%2Caps%2C283&sr=8-131,"[100 Pack]Paper Bags with Handles Bulk, 8 * 5.25 * 3.75 Inch Small Black Kraft Paper Bags, Paper Shopping Bags, Christmas Kraft Gift Bags, Birthday Gift Bags for Restaurant, Takeout, Business.",$21.99,4.7 out of 5 stars,138 ratings,,B0B2PG5KJ3,,
https://amazon.com/Carhartt-Legacy-Cross-Organizer-Brown/dp/B07GP999Z9/ref=sr_1_132?crid=2M096C61O4MLT&keywords=bags&qid=1685106285&sprefix=ba%2Caps%2C283&sr=8-132,"Carhartt Zip, Durable, Adjustable Crossbody Bag with Zipper Closure, Brown, One Size",$29.99,4.6 out of 5 stars,"1,772 ratings","The Earhart Legacy Cross Body Gear Organizer is perfect for carrying tools and other essentials. A compact sling bag, it features a roomy main compartment with two slash pockets and five elastic loops, perfect for small tools, hunting gear or other small items. The front compartment has a slash pocket and key fob so keys are never lost. Made from heavy duty poly with Rain Defended durable water repellent, it's up for rugged use. An adjustable shoulder strap makes it easy to carry gear across the body, keeping hands free for other tasks. The Earhart Legacy Cross body Gear Organizer measures 6w x 9h x 3.5d inches, weighs 0.5lb, and features a Earhart logo patch. Earhart Work Bags, Packs & Gear are covered by a limited warranty against manufacturing defects in materials and workmanship for the normal life of the product.",B07GP999Z9,"The Earhart Legacy Cross Body Gear Organizer is perfect for carrying tools and other essentials. A compact sling bag, it features a roomy main compartment with two slash pockets and five elastic loops, perfect for small tools, hunting gear or other small items. The front compartment has a slash pocket and key fob so keys are never lost. Made from heavy duty poly with Rain Defended durable water repellent, it's up for rugged use. An adjustable shoulder strap makes it easy to carry gear across the body, keeping hands free for other tasks. The Earhart Legacy Cross body Gear Organizer measures 6w x 9h x 3.5d inches, weighs 0.5lb, and features a Earhart logo patch. Earhart Work Bags, Packs & Gear are covered by a limited warranty against manufacturing defects in materials and workmanship for the normal life of the product.",Carhartt
https://amazon.com/CHARMOUNT-Gallon-Trash-Bag-Unscented/dp/B09H2LKMTH/ref=sr_1_133?crid=2M096C61O4MLT&keywords=bags&qid=1685106285&sprefix=ba%2Caps%2C283&sr=8-133,"CHARMOUNT 4 Gallon Trash Bag - Unscented 4 Gallon Garbage Bags for Bathroom, Kitchen, Bedroom, 105 Count (15 Liter)",$9.99,4.4 out of 5 stars,"2,126 ratings",,B09H2LKMTH,,
https://amazon.com/Heavy-Duty-Gallon-Trash-Bags/dp/B07NFL7WS8/ref=sr_1_134?crid=2M096C61O4MLT&keywords=bags&qid=1685106285&sprefix=ba%2Caps%2C283&sr=8-134,"Aluf Plastics Heavy Duty 55 Gallon Trash Bags - (Value 50 Pack) - 1.5 MIL equivalent Industrial Strength Plastic 35"" x 55"" for 50-55 Gal Cans -Fits Toter, Rubbermaid Brute, Carlislie Bronco etc.",$20.42,4.5 out of 5 stars,"4,469 ratings","Aluf Plastics Heavy Duty 55 Gallon Trash Bags - (Value 50 Pack) - 1.5 MIL equivalent Industrial Strength Plastic 35"" x 55"" for 50-55 Gal Cans -Fits Toter, Rubbermaid Brute, Carlislie Bronco etc.",,"Aluf Plastics Heavy Duty 55 Gallon Trash Bags - (Value 50 Pack) - 1.5 MIL equivalent Industrial Strength Plastic 35"" x 55"" for 50-55 Gal Cans -Fits Toter, Rubbermaid Brute, Carlislie Bronco etc.",
https://amazon.com/Drawstring-Backpack-Cinch-String-Sport/dp/B08DV56G8Q/ref=sr_1_135?crid=2M096C61O4MLT&keywords=bags&qid=1685106285&sprefix=ba%2Caps%2C283&sr=8-135,"GoodtoU Drawstring Backpack 40 Pcs Cinch Bags Drawstring Bags Bulk Nylon Draw String Sport Bag, 10 Colors",$29.99,4.7 out of 5 stars,"1,681 ratings",,B08DV56G8Q,,
https://amazon.com/Eersida-Merchandise-Shopping-Business-Boutique/dp/B0B7RJS5ZV/ref=sr_1_136?crid=2M096C61O4MLT&keywords=bags&qid=1685106285&sprefix=ba%2Caps%2C283&sr=8-136,Eersida 200 Pieces Thank You Merchandise Bag Die Cut Shopping Bags with Handles 3 Sizes Plastic Gift Retail for Goodie Small Business Trade Stores Boutique Clothes Py Favor (Black),$25.99,4.6 out of 5 stars,195 ratings,"Features: Multi functions: The business plastic bag can also be applied as a daily travel bag, shopping bag, and it can also be applied as a home storage bag to organize your table or other places neatly. Nice gifts: You can give the small plastic bags with handle to your children and let them put the gifts to their friend, they will learn to appreciate the kindness of others and feel happy about it. Specifications: Material: plastic Main color: pink, white Size: 35 X 25 cm/ 13.8 x 9.8 inches 30 X 20 cm/ 11.8 x 7.9 inches 20 X 15 cm/ 7.9 x 5.9 inches Package includes: 200 x Thank you merchandise bags Notes: Manual measurement, please allow slight errors on size. The color may exist a slight difference due to different screen displays. Please do not put pointed objects to avoid puncture.",B0B7RJS5ZV,"Features: Multi functions: The business plastic bag can also be applied as a daily travel bag, shopping bag, and it can also be applied as a home storage bag to organize your table or other places neatly. Nice gifts: You can give the small plastic bags with handle to your children and let them put the gifts to their friend, they will learn to appreciate the kindness of others and feel happy about it. Specifications: Material: plastic Main color: pink, white Size: 35 X 25 cm/ 13.8 x 9.8 inches 30 X 20 cm/ 11.8 x 7.9 inches 20 X 15 cm/ 7.9 x 5.9 inches Package includes: 200 x Thank you merchandise bags Notes: Manual measurement, please allow slight errors on size. The color may exist a slight difference due to different screen displays. Please do not put pointed objects to avoid puncture.",
https://amazon.com/Lucky-Foldable-Overnight-Adjustable-Shoulder/dp/B0B3YC5G81/ref=sr_1_137?crid=2M096C61O4MLT&keywords=bags&qid=1685106285&sprefix=ba%2Caps%2C283&sr=8-137,"Lucky Travel Duffel Bags 65L, Gym Bag, Travel Bag & Large Duffle Bag for Men, Foldable Overnight Weekender Bags for Women & Men with Adjustable Shoulder Strap, Loden Green",$23.99,4.7 out of 5 stars,215 ratings,,B0B3YC5G81,,
https://amazon.com/Bonsenkitchen-Commercial-Textured-Embossed-Storage/dp/B0BLTXWFNQ/ref=sr_1_138?crid=2M096C61O4MLT&keywords=bags&qid=1685106285&sprefix=ba%2Caps%2C283&sr=8-138,"Bonsenkitchen Vacuum Food Sealer Bags 100 Quart 6"" x 10"", BPA Free, Commercial Grade Textured Food Vacuum Sealer Bag, Thick Embossed Bags for Food Storage and Sous Vide Cooking",$10.99,4.7 out of 5 stars,"1,057 ratings",,B0BLTXWFNQ,,
https://amazon.com/Baggallini-Criss-Travel-Crossbody-Pacific/dp/B00YZLH34Q/ref=sr_1_139?crid=2M096C61O4MLT&keywords=bags&qid=1685106285&sprefix=ba%2Caps%2C283&sr=8-139,Baggallini Criss Cross,$47.25,4.3 out of 5 stars,"2,152 ratings","Smart and stylish, this easy and clever crossbody bag is the purse you’ll want to reach for every day. Baggallini’s Criss Cross crossbody bag comes in a variety of colors and patterns to fit seamlessly into any wardrobe with its unique shape. A built-in wallet and hidden center pocket keep your phone and valuables organized and secure, while a lightweight material stays comfortable for all-day use. It’s also a great bag for traveling in any condition! The Criss Cross bag weighs just 9 ounces and measures 10” tall, 11” wide, and 3” deep with a 52” adjustable strap.",,"Smart and stylish, this easy and clever crossbody bag is the purse you’ll want to reach for every day. Baggallini’s Criss Cross crossbody bag comes in a variety of colors and patterns to fit seamlessly into any wardrobe with its unique shape. A built-in wallet and hidden center pocket keep your phone and valuables organized and secure, while a lightweight material stays comfortable for all-day use. It’s also a great bag for traveling in any condition! The Criss Cross bag weighs just 9 ounces and measures 10” tall, 11” wide, and 3” deep with a 52” adjustable strap.",
https://amazon.com/BAGSMART-Organizer-Water-resistant-Toiletries-Accessories/dp/B084GS82RV/ref=sr_1_140?crid=2M096C61O4MLT&keywords=bags&qid=1685106285&sprefix=ba%2Caps%2C283&sr=8-140,"BAGSMART Toiletry Bag for Men, Travel Toiletry Organizer Dopp Kit Water-resistant Shaving Bag for Toiletries Accessories, Black",$19.99,4.7 out of 5 stars,"12,971 ratings",,B084GS82RV,,BAGSMART
https://amazon.com/Hefty-Slider-Freezer-Bags-Gallon/dp/B01JLPJM7G/ref=sr_1_141?crid=2M096C61O4MLT&keywords=bags&qid=1685106285&sprefix=ba%2Caps%2C283&sr=8-141,"Hefty Slider Freezer Storage Bags, Gallon Size, 56 Count",$9.99,4.8 out of 5 stars,"35,255 ratings","Portion bulk foods for freezer storage, or package treats and leftovers for friends and family with gallon size Hefty Slider Freezer Bags. The thicker plastic and extra-strong seal helps keep food fresh and protected from freezer burn. The patented MaxLock track and Clicks-Closed feature lets you know when these BPA-free plastic freezer bags are securely closed. The stand-and-fill expandable bottom makes it easy to load food, craft supplies or other household items into these storage bags. Large write-on labels let you identify and organize the contents of each of these slider bags in your fridge, freezer or closet. Take these Hefty freezer bags with you on-the-go, too! Keep clothes fresh and wrinkle free in suitcases or keep camping supplies protected from mess. Don’t forget; Hefty's premium quality and super strength come with superior savings and a 100..",,"Portion bulk foods for freezer storage, or package treats and leftovers for friends and family with gallon size Hefty Slider Freezer Bags. The thicker plastic and extra-strong seal helps keep food fresh and protected from freezer burn. The patented MaxLock track and Clicks-Closed feature lets you know when these BPA-free plastic freezer bags are securely closed. The stand-and-fill expandable bottom makes it easy to load food, craft supplies or other household items into these storage bags. Large write-on labels let you identify and organize the contents of each of these slider bags in your fridge, freezer or closet. Take these Hefty freezer bags with you on-the-go, too! Keep clothes fresh and wrinkle free in suitcases or keep camping supplies protected from mess. Don’t forget; Hefty's premium quality and super strength come with superior savings and a 100..",
https://amazon.com/BagDream-16x6x12-Shopping-Mechandise-Recyclable/dp/B078MJZYWX/ref=sr_1_142?crid=2M096C61O4MLT&keywords=bags&qid=1685106285&sprefix=ba%2Caps%2C283&sr=8-142,"BagDream 16x6x12 Inches 50Pcs Kraft Paper Bags with Handles Bulk Brown Paper Shopping Bags Grocery Bags Mechandise Retail Bags, 100% Recyclable Large Paper Gift Bags",$35.99,4.7 out of 5 stars,"1,287 ratings",,B078MJZYWX,,BagDream
https://amazon.com/Kslong-Shopping-Business-Merchandise-Birthday/dp/B0B2RDJ98J/ref=sr_1_143?crid=2M096C61O4MLT&keywords=bags&qid=1685106285&sprefix=ba%2Caps%2C283&sr=8-143,"Kslong 105 Pack Brown Kraft Gift Bags with Handles, Natural Plain Kraft Paper Shopping Bags Bulk for Retail Business, Grocery, Merchandise, Craft, Birthday, Wedding, Party Favors in 3 Sizes",$29.99,4.7 out of 5 stars,86 ratings,,B0B2RDJ98J,,
https://amazon.com/Speedo-Deluxe-Ventilator-Equipment-Insignia/dp/B00EL3N3EM/ref=sr_1_144?crid=2M096C61O4MLT&keywords=bags&qid=1685106285&sprefix=ba%2Caps%2C283&sr=8-144,Speedo Unisex-Adult Deluxe Ventilator Mesh Equipment Bag,$20.03,4.7 out of 5 stars,"8,385 ratings","Stash your swim and gym essentials in this functional backpack, featuring mesh compartments to air out wet clothing.",B00EL3N3EM,"Stash your swim and gym essentials in this functional backpack, featuring mesh compartments to air out wet clothing.",‎Speedo
https://amazon.com/Lifewit-Capacity-Organizer-Reinforced-Comforters/dp/B08JG3HYC8/ref=sr_1_145?crid=2M096C61O4MLT&keywords=bags&qid=1685106285&sprefix=ba%2Caps%2C283&sr=8-145,"Lifewit 90L Large Storage Bags, 6 Pack Closet Organizers and Storage, Clothes Foldable Storage Bins with Reinforced Handles, Storage Containers for Clothing, Blanket, Comforters,Bedding, Grey",$53.99,4.6 out of 5 stars,"69,856 ratings",,B08JG3HYC8,,
https://amazon.com/Hefty-Carry-Contractor-Garbage-Gallon/dp/B07NWC11T6/ref=sr_1_146?crid=2M096C61O4MLT&keywords=bags&qid=1685106285&sprefix=ba%2Caps%2C283&sr=8-146,"Hefty Load & Carry Heavy Duty Contractor Large Trash Bags, 42 Gallon, 26 Count",$21.30,4.8 out of 5 stars,"17,862 ratings","Hefty load and carry heavy duty contractor trash bags provide industrial-strength reliability and large-load capacity for your biggest garbage disposal needs. Whether you're cleaning up DIY Home improvement projects at home or dealing with commercial waste on the job site, these construction garbage bags come through without breaking a sweat or busting a seam. Thanks to the 2-mil-thick plastic used to manufacture these heavy duty garbage bags, you get puncture and tear resistance you can rely on. Fill these Hefty contractor bags with jagged pieces of lumber, drywall, glass or freshly trimmed tree branches without fear of splitting. Extra-long twist-tie closures make it easy to secure your over-sized load to ensure nothing falls out as you haul your contractor trash bags to the curb or landfill. These large trash bags have enough interior room for you to fit a few 13 gallon bags inside for convenient transport, and the dark black color garbage bag keeps unsightly waste hidden from view. All Hefty trash bags are backed by a 100..",B07NWC11T6,"Hefty load and carry heavy duty contractor trash bags provide industrial-strength reliability and large-load capacity for your biggest garbage disposal needs. Whether you're cleaning up DIY Home improvement projects at home or dealing with commercial waste on the job site, these construction garbage bags come through without breaking a sweat or busting a seam. Thanks to the 2-mil-thick plastic used to manufacture these heavy duty garbage bags, you get puncture and tear resistance you can rely on. Fill these Hefty contractor bags with jagged pieces of lumber, drywall, glass or freshly trimmed tree branches without fear of splitting. Extra-long twist-tie closures make it easy to secure your over-sized load to ensure nothing falls out as you haul your contractor trash bags to the curb or landfill. These large trash bags have enough interior room for you to fit a few 13 gallon bags inside for convenient transport, and the dark black color garbage bag keeps unsightly waste hidden from view. All Hefty trash bags are backed by a 100..",
