Product URL,Product Name,Product Price,Rating,Number of reviews,Description,ASIN,Product Description,Manufacturer
https://amazon.com/Lululemon-Athletica-Everywhere-Belt-Silver/dp/B09468P4MH/ref=sr_1_216?crid=2M096C61O4MLT&keywords=bags&qid=1685106953&sprefix=ba%2Caps%2C283&sr=8-216,"Lululemon Athletica, Lululemon Everywhere Belt Bag 1L (Silver Drop)",$54.99,4.8 out of 5 stars,428 ratings,"This functional belt bag can hold your phone, wallet, and keys during all your urban outings. Fabric is water-resistant and easy to wipe clean.",B09468P4MH,"This functional belt bag can hold your phone, wallet, and keys during all your urban outings. Fabric is water-resistant and easy to wipe clean.",
https://amazon.com/gp/slredirect/picassoRedirect.html/ref=pa_sp_mtf_aps_sr_pg5_1?ie=UTF8&adId=A050441922NCIM5AH887F&qualifier=1685106953&id=1896969226628487&widgetName=sp_mtf&url=%2FPieces-Reusable-Grocery-Handles-Portable%2Fdp%2FB0BC1P5NXP%2Fref%3Dsr_1_217_sspa%3Fcrid%3D2M096C61O4MLT%26keywords%3Dbags%26qid%3D1685106953%26sprefix%3Dba%252Caps%252C283%26sr%3D8-217-spons%26psc%3D1,100 Pieces Reusable Totes Bag Set Non Woven Grocery Bag with Handles Fabric Portable Tote Bag Bulk for Shopping Merchandise Events Parties Boutiques Retail Stores (Black),$59.99,4.4 out of 5 stars,64 ratings,,B0BC1P5NXP,,Reginary
https://amazon.com/gp/slredirect/picassoRedirect.html/ref=pa_sp_mtf_aps_sr_pg5_1?ie=UTF8&adId=A093724112NU8I2TQSHZP&qualifier=1685106953&id=1896969226628487&widgetName=sp_mtf&url=%2FBAGSMART-Packing-Organizer-Perfectly-Luggage%2Fdp%2FB081JQ71DH%2Fref%3Dsr_1_218_sspa%3Fcrid%3D2M096C61O4MLT%26keywords%3Dbags%26qid%3D1685106953%26sprefix%3Dba%252Caps%252C283%26sr%3D8-218-spons%26psc%3D1,"Packing Cubes for Suitcases, BAGSMART 7 Set Packing Cubes for Travel Essentials, Lightweight Luggage Suitcase Organizer Bags Set with Shoe Bag, Keep Shape Travel Cubes for Packing",$24.99,4.6 out of 5 stars,817 ratings,,,,
https://amazon.com/gp/slredirect/picassoRedirect.html/ref=pa_sp_mtf_aps_sr_pg5_1?ie=UTF8&adId=A00901093C7VQGKXIH2AA&qualifier=1685106953&id=1896969226628487&widgetName=sp_mtf&url=%2FTUMI-%25E3%2583%2588%25E3%2582%25A5%25E3%2583%259F-0232712-Contemporary-Biege%2Fdp%2FB0B49N73SR%2Fref%3Dsr_1_219_sspa%3Fcrid%3D2M096C61O4MLT%26keywords%3Dbags%26qid%3D1685106953%26sprefix%3Dba%252Caps%252C283%26sr%3D8-219-spons%26psc%3D1,TUMI - Alpha Bravo Retreat Tote - Sand,$395.00,5.0 out of 5 stars,1 rating,"About the product Designed to keep your essentials organized and organized while on the go, this lightweight tote bag features multiple pockets on the interior and exterior. Equipped with a tablet pocket, a quick access pocket for easy access to your phone, and more, you can set up with your luggage The adjustable shoulder strap can be put on and taken off with a single touch, and can be stored in the pocket inside the bag when not in use. You can expand the storage capacity according to your needs by combining it with the separately sold TUMI+ accessories. Alpha Bravo is a collection of practical features that are modern with a focus on durability, modularity and sustainability. It has an impressive, yet discreet logo arrangement, a design that inherits Tumi's DNA and unique sensibility. *Product specifications may change without prior notice. Exterior Main compartment with built-in fidlock magnetic speed clip that opens and closes with one hand Daisy chain loops for attaching modular accessories (sold separately) on the front and sides Adjustable shoulder strap (fits inside open pocket) Front zip pocket Back zipper pocket Top carry handle with leather accents Quick access pocket (with magnetic snap) for convenient storage of mobile phone and commuter trips. Add-a Bag Sleeve ID Tag Interior Key Leash Daisy chain loop for attaching modular accessories (sold separately) Padded protective tablet pocket 2 open pockets (one can hold shoulder strap, the other is waterproof for convenient carrying of umbrella, etc. ) Zipper pocket",,"About the product Designed to keep your essentials organized and organized while on the go, this lightweight tote bag features multiple pockets on the interior and exterior. Equipped with a tablet pocket, a quick access pocket for easy access to your phone, and more, you can set up with your luggage The adjustable shoulder strap can be put on and taken off with a single touch, and can be stored in the pocket inside the bag when not in use. You can expand the storage capacity according to your needs by combining it with the separately sold TUMI+ accessories. Alpha Bravo is a collection of practical features that are modern with a focus on durability, modularity and sustainability. It has an impressive, yet discreet logo arrangement, a design that inherits Tumi's DNA and unique sensibility. *Product specifications may change without prior notice. Exterior Main compartment with built-in fidlock magnetic speed clip that opens and closes with one hand Daisy chain loops for attaching modular accessories (sold separately) on the front and sides Adjustable shoulder strap (fits inside open pocket) Front zip pocket Back zipper pocket Top carry handle with leather accents Quick access pocket (with magnetic snap) for convenient storage of mobile phone and commuter trips. Add-a Bag Sleeve ID Tag Interior Key Leash Daisy chain loop for attaching modular accessories (sold separately) Padded protective tablet pocket 2 open pockets (one can hold shoulder strap, the other is waterproof for convenient carrying of umbrella, etc. ) Zipper pocket",
https://amazon.com/gp/slredirect/picassoRedirect.html/ref=pa_sp_mtf_aps_sr_pg5_1?ie=UTF8&adId=A08881693IL5MW2SJA10L&qualifier=1685106953&id=1896969226628487&widgetName=sp_mtf&url=%2FZMYGOLON-Waterproof-Shoulder-Foldable-Essentials%2Fdp%2FB0BZVBR1KN%2Fref%3Dsr_1_220_sspa%3Fcrid%3D2M096C61O4MLT%26keywords%3Dbags%26qid%3D1685106953%26sprefix%3Dba%252Caps%252C283%26sr%3D8-220-spons%26psc%3D1,"ZMYGOLON Mesh Beach Tote Bag with 2 Waterproof Phone Pouch, Women Shoulder Handbag Foldable Pool Bag for Travel Essentials",$15.99,5.0 out of 5 stars,3 ratings,,,,
https://amazon.com/ETRONIK-Overnight-Weekender-Toiletry-Hospital/dp/B0BQ31XVSS/ref=sr_1_221?crid=2M096C61O4MLT&keywords=bags&qid=1685106953&sprefix=ba%2Caps%2C283&sr=8-221,"ETRONIK Overnight Bags for Women, Travel Weekender Bags with Wet Pocket & Shoe Bag & Toiletry Bag, Carry on Travel Duffel Bags for Gym Hospital Gift Daily Use, 5 Pcs Set, Beige",$39.99,4.4 out of 5 stars,59 ratings,,B0BQ31XVSS,,ETRONIK
https://amazon.com/Hefty-Slider-Freezer-Calendar-Gallon/dp/B0B34YLF6V/ref=sr_1_222?crid=2M096C61O4MLT&keywords=bags&qid=1685106953&sprefix=ba%2Caps%2C283&sr=8-222,"Hefty Slider Freezer Calendar Bags, Gallon Size, 100 Total Bags, 25 Count (Pack of 4)",$18.99,4.7 out of 5 stars,548 ratings,"Hefty Slider Freezer Calendar Bags provide a simple strategy for solving the mystery of what you’ve stored and for how long. Simply use the large write-on labels on these storage bags to label the contents, circle the month and date on the printed-on calendar, and store away! No more guesswork. The thicker plastic and extra-strong seal on these easy-to-use slider freezer bags help keep food fresh and protected from freezer burn. The patented, easy-to-use MaxLock track and Clicks-Closed feature lets you know when these BPA-free plastic bags for food storage are securely closed. Plus, the stand-and-fill expandable bottom makes it easy to load leftovers, meal prep, fruit, and more into these gallon slider bags with ease. Hefty's premium quality and super strength come with superior savings and a 100% satisfaction guarantee.",,"Hefty Slider Freezer Calendar Bags provide a simple strategy for solving the mystery of what you’ve stored and for how long. Simply use the large write-on labels on these storage bags to label the contents, circle the month and date on the printed-on calendar, and store away! No more guesswork. The thicker plastic and extra-strong seal on these easy-to-use slider freezer bags help keep food fresh and protected from freezer burn. The patented, easy-to-use MaxLock track and Clicks-Closed feature lets you know when these BPA-free plastic bags for food storage are securely closed. Plus, the stand-and-fill expandable bottom makes it easy to load leftovers, meal prep, fruit, and more into these gallon slider bags with ease. Hefty's premium quality and super strength come with superior savings and a 100% satisfaction guarantee.",
https://amazon.com/Approved-Toiletry-Accessories-Toiletries-Cosmetic/dp/B08D3H2DJR/ref=sr_1_223?crid=2M096C61O4MLT&keywords=bags&qid=1685106953&sprefix=ba%2Caps%2C283&sr=8-223,TSA Approved Clear Travel Toiletry Bag wih Zippers Carry-on Travel Accessories Quart Size Toiletries Cosmetic Pouch Makeup Bags for Men and Women (2 pcs),$7.99,4.6 out of 5 stars,"4,255 ratings",,,,
https://amazon.com/JETech-Shoulder-Compatible-15-6-Inch-Waterproof/dp/B09C1LFXX8/ref=sr_1_224?crid=2M096C61O4MLT&keywords=bags&qid=1685106953&sprefix=ba%2Caps%2C283&sr=8-224,"JETech Laptop Shoulder Bag Compatible with 15.6-Inch Tablet and Computer, Waterproof Carrying Case with Portable Handle, Black",$17.99,4.6 out of 5 stars,449 ratings,,‎B09C1LFXX8,,
https://amazon.com/Makeup-Cosmetic-Organizer-Portable-Leather/dp/B08S455Z81/ref=sr_1_225?crid=2M096C61O4MLT&keywords=bags&qid=1685106953&sprefix=ba%2Caps%2C283&sr=8-225,"Small Makeup Bag, Relavel Cosmetic Bag for Women 2 Layer Travel Makeup Organizer Black Handbag Purse Pouch Compact Capacity for Daily Use, Makeup Brush Holder, Waterproof Nylon, Durable Zipper (Black)",$9.99,4.5 out of 5 stars,"5,120 ratings",,,,
https://amazon.com/Michael-Kors-Large-Cross-body-Vanilla/dp/B07Y2BP7F2/ref=sr_1_226?crid=2M096C61O4MLT&keywords=bags&qid=1685106953&sprefix=ba%2Caps%2C283&sr=8-226,Michael Kors Jet Set,$72.98,4.8 out of 5 stars,"12,250 ratings","Jet setters, take note: this sophisticated, multi-tasking tote is the ultimate travel accomplice. Crafted from saffiano—a matte leather that’s both distinctive and durable sports a look that’s chic yet understated. A multitude of pockets keeps you organized, while the top-zip design ensures your essentials stay put, wherever you may go.",,"Jet setters, take note: this sophisticated, multi-tasking tote is the ultimate travel accomplice. Crafted from saffiano—a matte leather that’s both distinctive and durable sports a look that’s chic yet understated. A multitude of pockets keeps you organized, while the top-zip design ensures your essentials stay put, wherever you may go.",
https://amazon.com/Twinings-London-English-Breakfast-Black/dp/B001GM60LE/ref=sr_1_227?crid=2M096C61O4MLT&keywords=bags&qid=1685106953&sprefix=ba%2Caps%2C283&sr=8-227,"Twinings English Breakfast Black Tea, 100 Individually Wrapped Tea Bags, Smooth, Flavourful, Robust, Caffeinated",$11.42,4.7 out of 5 stars,"80,300 ratings","Twinings of London English Breakfast Black Tea Bags, 100 Count (Pack of 1).",,"Twinings of London English Breakfast Black Tea Bags, 100 Count (Pack of 1).",
https://amazon.com/Amazon-Basics-Storage-Previously-Solimo/dp/B095PMD8JG/ref=sr_1_228?crid=2M096C61O4MLT&keywords=bags&qid=1685106953&sprefix=ba%2Caps%2C283&sr=8-228,"Amazon Basics Snack Storage Bags, 300 Count (Previously Solimo)",$7.81,4.8 out of 5 stars,"3,774 ratings","Product Description   Amazon Basics Snack Storage Bags, 300 Count   From the Manufacturer   Amazon Basics",,"Product Description   Amazon Basics Snack Storage Bags, 300 Count   From the Manufacturer   Amazon Basics",
https://amazon.com/Michael-Kors-Luggage-Saffiano-Leather/dp/B09HNBJ1BK/ref=sr_1_229?crid=2M096C61O4MLT&keywords=bags&qid=1685106953&sprefix=ba%2Caps%2C283&sr=8-229,Michael Kors Drop,$106.97,4.7 out of 5 stars,"1,398 ratings","DESIGNLaid-back yet luxe, our Rhea backpack redefines big-city accessorizing. We love the combination of our signature logo print against the high-shine hardware. With its multiple zipper pockets and delicate shoulder straps, it’s a feminine take on the enduring design. DETAILS• 100% Coated Twill • Gold-Tone Hardware • 9.5""W X 12.5""H X 5""D • Handle Drop: 1"" • Exterior Details: 2 Front Zip Compartments • Interior Details: Back Zip Pocket, Back Slit Pocket, 4 Front Slit Pockets • Lining: 100% Polyester • Imported",,"DESIGNLaid-back yet luxe, our Rhea backpack redefines big-city accessorizing. We love the combination of our signature logo print against the high-shine hardware. With its multiple zipper pockets and delicate shoulder straps, it’s a feminine take on the enduring design. DETAILS• 100% Coated Twill • Gold-Tone Hardware • 9.5""W X 12.5""H X 5""D • Handle Drop: 1"" • Exterior Details: 2 Front Zip Compartments • Interior Details: Back Zip Pocket, Back Slit Pocket, 4 Front Slit Pockets • Lining: 100% Polyester • Imported",
https://amazon.com/Curravax-Pill-Bags-Pack-500/dp/B09SBL4TP2/ref=sr_1_230?crid=2M096C61O4MLT&keywords=bags&qid=1685106953&sprefix=ba%2Caps%2C283&sr=8-230,CURRAVAX Pill Bags Pack of 500 - BPA Free 3 x 2.75 inch Pill Pouch - Reusable Pill Pouches for Medicine with Write on Label –Clear Ziplock Pill Baggies for Travel Medicine Organizer,$13.99,4.7 out of 5 stars,754 ratings,"It's a difficult life when you have to carry thick boxes of medicines, especially during your time abroad. We have found the ultimate solution for your pill problem: pill ziplock bags  With a waterproof structure and a spacious interior, our pill bags for medicine daily are designed to hold more than 5 pills with ease. You do not have to worry about it ripping out or getting damaged. It's all in good hands!  Moreover, unlike solid pill box organizers, our reusable daily pill bags fit in your purses with no trouble, so you do not have to miss out on your medication on a girl’s night out.  Our airtight the pill bag help you secure all types of capsules and meds, keeping them away from moisture or any liquid danger. Who can’t afford to buy medication again and again in this expensive economy?  Having said that, our pill packs for travel can also be used as jewellery bags, you can carry or organize your tiny accessories and ditch those hefty compartment boxes.  Our pill packs for medicine daily are the ultimate solution to your storage problems. Grab your today to leave a healthier and organized lifestyle!",,"It's a difficult life when you have to carry thick boxes of medicines, especially during your time abroad. We have found the ultimate solution for your pill problem: pill ziplock bags  With a waterproof structure and a spacious interior, our pill bags for medicine daily are designed to hold more than 5 pills with ease. You do not have to worry about it ripping out or getting damaged. It's all in good hands!  Moreover, unlike solid pill box organizers, our reusable daily pill bags fit in your purses with no trouble, so you do not have to miss out on your medication on a girl’s night out.  Our airtight the pill bag help you secure all types of capsules and meds, keeping them away from moisture or any liquid danger. Who can’t afford to buy medication again and again in this expensive economy?  Having said that, our pill packs for travel can also be used as jewellery bags, you can carry or organize your tiny accessories and ditch those hefty compartment boxes.  Our pill packs for medicine daily are the ultimate solution to your storage problems. Grab your today to leave a healthier and organized lifestyle!",
https://amazon.com/Nuliie-Breastmilk-Pre-sterilized-Breastfeeding-Self-Standing/dp/B091T8WFCW/ref=sr_1_231?crid=2M096C61O4MLT&keywords=bags&qid=1685106953&sprefix=ba%2Caps%2C283&sr=8-231,"Nuliie 120 Pcs Breastmilk Storage Bags, 8 OZ Breast Milk Storing Bags, BPA Free, Milk Storage Bags with Pour Spout for Breastfeeding, Self-Standing Bag, Space Saving Flat Profile",$19.99,4.6 out of 5 stars,"4,219 ratings",,B091T8WFCW,,
https://amazon.com/Fossil-ZB7266001-Fiona-Small-Crossbody/dp/B01NBWBCK9/ref=sr_1_232?crid=2M096C61O4MLT&keywords=bags&qid=1685106953&sprefix=ba%2Caps%2C283&sr=8-232,Fossil Women's Fiona Small Crossbody Purse Handbag,$75.09,4.6 out of 5 stars,"2,007 ratings","Fossil women's handbags are built to be your stylish staples, your classic fashion pieces and your functional favorites. Our designers combine high-quality materials with unique details and silhouettes to create bags that go beyond storage (although there's a lot of that).",,"Fossil women's handbags are built to be your stylish staples, your classic fashion pieces and your functional favorites. Our designers combine high-quality materials with unique details and silhouettes to create bags that go beyond storage (although there's a lot of that).",
https://amazon.com/Toiletry-Water-resistant-Toiletries-Accessories-Cosmetics/dp/B098DSKJNV/ref=sr_1_233?crid=2M096C61O4MLT&keywords=bags&qid=1685106953&sprefix=ba%2Caps%2C283&sr=8-233,"FUNSEED Travel Toiletry Bag for Women and Men, Water-resistant Shaving Bag for Toiletries Accessories, Foldable Storage Bags with Divider and Handle for Cosmetics Toiletries Brushes Tools (Black)",$6.99,4.4 out of 5 stars,"4,099 ratings",,B098DSKJNV,,
https://amazon.com/HIBAG-Storage-Bedding-Comforter-Pillows/dp/B075ZT41PR/ref=sr_1_234?crid=2M096C61O4MLT&keywords=bags&qid=1685106953&sprefix=ba%2Caps%2C283&sr=8-234,"Vacuum Storage Bags, Space Saver Vacuum Seal Storage Bags 20-Pack Sealer Bags for Clothes, Clothing, Bedding, Comforter, Blanket (20C)",$49.99,4.4 out of 5 stars,"36,103 ratings",,B075ZT41PR,,
https://amazon.com/Bulk-Tote-Bag-Mega-Pack/dp/B071JGRTLW/ref=sr_1_235?crid=2M096C61O4MLT&keywords=bags&qid=1685106953&sprefix=ba%2Caps%2C283&sr=8-235,Sea View Treasures 50 Bulk Tote Bag Mega Pack - 15” x 16” Large Reusable Shopping Bags (Multi),$44.99,4.2 out of 5 stars,561 ratings,,B071JGRTLW,,SVT
https://amazon.com/adidas-Festival-Crossbody-Black-White/dp/B07YPBM4K4/ref=sr_1_236?crid=2M096C61O4MLT&keywords=bags&qid=1685106953&sprefix=ba%2Caps%2C283&sr=8-236,"adidas Core Festival Crossbody, Black/White, One Size",$22.99,4.6 out of 5 stars,"1,020 ratings",This crossbody bag is just the right size for a concert or a trip to the mall. it's made of sturdy woven fabric. an extra pocket on the front holds small essentials.,B07YPBM4K4,This crossbody bag is just the right size for a concert or a trip to the mall. it's made of sturdy woven fabric. an extra pocket on the front holds small essentials.,adidas
https://amazon.com/Shoulder-Computer-Messenger-Business-Briefcase/dp/B09R1DZF19/ref=sr_1_237?crid=2M096C61O4MLT&keywords=bags&qid=1685106953&sprefix=ba%2Caps%2C283&sr=8-237,Laptop Tote Bag for Women Work 15.6 inch Canvas Shoulder Bags Computer Messenger Purse Teacher Handbag Office Briefcase,$32.99,4.6 out of 5 stars,766 ratings,,,,
https://amazon.com/BagDream-Kraft-Paper-Shopping-Handles/dp/B06XPN9GQJ/ref=sr_1_238?crid=2M096C61O4MLT&keywords=bags&qid=1685106953&sprefix=ba%2Caps%2C283&sr=8-238,"BagDream Kraft Paper Bags 25Pcs 5.25x3.75x8 Inches Small Paper Gift Bags Shopping Bags, Kraft Bags, Party Favor Bags, Black Gift Bags with Handles Bulk",$24.99,4.7 out of 5 stars,"6,223 ratings",,,,
https://amazon.com/ANECO-Compostable-Kitchen-Compost-Countertop/dp/B09YXHXRXC/ref=sr_1_239?crid=2M096C61O4MLT&keywords=bags&qid=1685106953&sprefix=ba%2Caps%2C283&sr=8-239,"ANECO 100% Compostable Trash Bags 2.6 Gallon, Extra Thick Kitchen Compost Bags, Small Compostable Bags for Countertop Bin (100 Count)",$24.99,4.6 out of 5 stars,"1,736 ratings",,B09YXHXRXC,,
https://amazon.com/BagDream-16x6x12-Shopping-Mechandise-Recyclable/dp/B07QVPSKDB/ref=sr_1_240?crid=2M096C61O4MLT&keywords=bags&qid=1685106953&sprefix=ba%2Caps%2C283&sr=8-240,"BagDream 100Pcs 16x6x12 Inches Kraft Paper Bags with Handles Bulk Gift Bags Shopping Bags for Grocery, Merchandise, Party, 100% Recyclable Large White Paper Bags",$59.99,4.5 out of 5 stars,287 ratings,,B07QVPSKDB,,BagDream
https://amazon.com/Fit-Fresh-Insulated-Compartment-Professional/dp/B07RWNB99M/ref=sr_1_241?crid=2M096C61O4MLT&keywords=bags&qid=1685106953&sprefix=ba%2Caps%2C283&sr=8-241,Fit + Fresh Metro Tote 2-in-1 Quilted Multi-Purpose Travel Bag,$23.99,4.5 out of 5 stars,931 ratings,,,,
https://amazon.com/FYY-Electronic-Organizer-Accessories-Waterproof/dp/B0924H4XB9/ref=sr_1_242?crid=2M096C61O4MLT&keywords=bags&qid=1685106953&sprefix=ba%2Caps%2C283&sr=8-242,"FYY Electronic Organizer, Travel Cable Organizer Bag Pouch Electronic Accessories Carry Case Portable Waterproof Double Layers All-in-One Storage Bag for Cable, Cord, Charger, Phone, Earphone Black",$12.99,4.4 out of 5 stars,"10,978 ratings",,B0924H4XB9,,"GUANGZHOU WENYI COMMUNICATION EQUIPMENT CO.,LTD"
https://amazon.com/Hefty-Strong-Large-Trash-Gallon/dp/B00M8ZEALK/ref=sr_1_243?crid=2M096C61O4MLT&keywords=bags&qid=1685106953&sprefix=ba%2Caps%2C283&sr=8-243,"Hefty Strong Large Trash Bags, 33 Gallon, 48 Count",$14.99,4.8 out of 5 stars,"27,004 ratings","Hefty Strong Large Multipurpose Trash Bags help you tackle cleanup jobs all around the house, thanks to their Hefty! Hefty! Hefty! strength and large capacity. With their 30 gallon size, these garbage bags are ideal for collecting old clothes for donation, seasonal decorations, everyday kitchen trash and more. Signature Hefty quality and thick 1.05 millimeter plastic ensure these large trash bags deliver superior puncture resistance for outside and inside jobs. Plus, with their dependable drawstring closure, these heavy duty plastic trash bags resist breakage and make transporting easy. Count on these large drawstring trash bags for the strength and reliability you expect from Hefty. Don’t forget: all Hefty trash bags are backed by a 100.",,"Hefty Strong Large Multipurpose Trash Bags help you tackle cleanup jobs all around the house, thanks to their Hefty! Hefty! Hefty! strength and large capacity. With their 30 gallon size, these garbage bags are ideal for collecting old clothes for donation, seasonal decorations, everyday kitchen trash and more. Signature Hefty quality and thick 1.05 millimeter plastic ensure these large trash bags deliver superior puncture resistance for outside and inside jobs. Plus, with their dependable drawstring closure, these heavy duty plastic trash bags resist breakage and make transporting easy. Count on these large drawstring trash bags for the strength and reliability you expect from Hefty. Don’t forget: all Hefty trash bags are backed by a 100.",
https://amazon.com/adidas-Team-Issue-Duffel-Black/dp/B07D9DQMQW/ref=sr_1_244?crid=2M096C61O4MLT&keywords=bags&qid=1685106953&sprefix=ba%2Caps%2C283&sr=8-244,"adidas Team Issue 2 Medium Duffel Bag, One Size",$55.00,4.7 out of 5 stars,"2,808 ratings",Keep gear organized and separated with this medium-size duffel bag. it's made of durable woven fabric with a water-resistant base. it has a spacious main compartment and a ventilated side pocket for wet or muddy shoes. a padded shoulder strap and padded handles make for comfortable carrying.,,Keep gear organized and separated with this medium-size duffel bag. it's made of durable woven fabric with a water-resistant base. it has a spacious main compartment and a ventilated side pocket for wet or muddy shoes. a padded shoulder strap and padded handles make for comfortable carrying.,
