Product URL,Product Name,Product Price,Rating,Number of reviews,Description,ASIN,Product Description,Manufacturer
https://amazon.com/gp/slredirect/picassoRedirect.html/ref=pa_sp_atf_aps_sr_pg1_1?ie=UTF8&adId=A0490932DVMDIPT5S2NT&qualifier=1685105477&id=6823567326512151&widgetName=sp_atf&url=%2FHaiquan-Handles-Shopping-Packaging-Recycled%25EF%25BC%2588Purple%25EF%25BC%2589%2Fdp%2FB09MPM5RZP%2Fref%3Dsr_1_1_sspa%3Fcrid%3D2M096C61O4MLT%26keywords%3Dbags%26qid%3D1685105477%26sprefix%3Dba%252Caps%252C283%26sr%3D8-1-spons%26psc%3D1,"HaiQuan Purple Gift Bags Kraft Paper Bags 50Pcs 8 x 4.75 x 10 inchs Paper Bulk Gift Bags With Handles for Shopping, Packaging, Wedding, Retail, Party, Recycled（Purple）",$17.99,4.5 out of 5 stars,40 ratings,,B09MPM5RZP,,
https://amazon.com/TOMNK-Handles-Perfect-Shopping-Merchandise/dp/B096RY5NMK/ref=sr_1_2?crid=2M096C61O4MLT&keywords=bags&qid=1685105477&sprefix=ba%2Caps%2C283&sr=8-2,"TOMNK 90pcs Brown Paper Bags with Handles Assorted Sizes Gift Bags Bulk,Goodie Bags, Kraft Paper Bags for Business, Shopping Bags, Retail Bags, Party Bags, Merchandise Bags, Favor Bags",$48.99,4.8 out of 5 stars,"1,807 ratings",,B096RY5NMK,,
https://amazon.com/Lululemon-Everywhere-Belt-Bag-LU9B78S/dp/B0B94RMN17/ref=sr_1_3?crid=2M096C61O4MLT&keywords=bags&qid=1685105477&sprefix=ba%2Caps%2C283&sr=8-3,"Lululemon Everywhere Belt Bag, (LU9B78S)",$36.39,4.7 out of 5 stars,737 ratings,"Lululemon Everywhere Belt Bag, (LU9B78S)",B0B94RMN17,"Lululemon Everywhere Belt Bag, (LU9B78S)",
https://amazon.com/Concession-Essentials-Thank-Bags-300ct/dp/B093TLNBSG/ref=sr_1_4?crid=2M096C61O4MLT&keywords=bags&qid=1685105477&sprefix=ba%2Caps%2C283&sr=8-4,Concession Essentials Thank You Bags Pack of 300ct White,$15.59,4.7 out of 5 stars,"3,731 ratings","Thank you bags measure 11.5"" X 6.25"" X 21"" - 0.60mil. Our bags are very durable with easy to carry handle design. Great for commercial use from bagging clothes, shoes, groceries and much more. Bags come in bulk, box of 300ct.",B093TLNBSG,"Thank you bags measure 11.5"" X 6.25"" X 21"" - 0.60mil. Our bags are very durable with easy to carry handle design. Great for commercial use from bagging clothes, shoes, groceries and much more. Bags come in bulk, box of 300ct.",Concession Essentials
https://amazon.com/Puma-Evercat-Runway-Duffel-Accessory/dp/B073HC4WYG/ref=sr_1_5?crid=2M096C61O4MLT&keywords=bags&qid=1685105477&sprefix=ba%2Caps%2C283&sr=8-5,PUMA Evercat Form Factor Duffel Bag,$19.53,4.7 out of 5 stars,"3,442 ratings","On the go with unlimited storage is just what you need for the everyday hassle. Dimensions: 21"" x 10"" x 9"".",,"On the go with unlimited storage is just what you need for the everyday hassle. Dimensions: 21"" x 10"" x 9"".",
https://amazon.com/Felipe-Varela-Compartment-Adjustable-Waterproof/dp/B09C7WQ123/ref=sr_1_6?crid=2M096C61O4MLT&keywords=bags&qid=1685105477&sprefix=ba%2Caps%2C283&sr=8-6,"Felipe Varela 65L Duffle Bag with Shoes Compartment and Adjustable Strap,Foldable Travel Duffel Bags for Men Women,Waterproof Duffel Bags",$19.99,4.3 out of 5 stars,"4,156 ratings",,B09C7WQ123,,
https://amazon.com/WISELIFE-Reusable-Shopping-Foldable-Groceries/dp/B093STG6TV/ref=sr_1_7?crid=2M096C61O4MLT&keywords=bags&qid=1685105477&sprefix=ba%2Caps%2C283&sr=8-7,"WISELIFE Reusable Grocery Shopping Bags 10 Pack Large Foldable Tote Bags Bulk, Eco Produce Bags with Long Handle for Shopping Groceries Clothes (Grey&Black)",$23.99,4.4 out of 5 stars,"4,702 ratings",,B093STG6TV,,WISELIFE
https://amazon.com/SimpleHouseware-60-Inch-Garment-Tuxedos-Dresses/dp/B07V57WL78/ref=sr_1_8?crid=2M096C61O4MLT&keywords=bags&qid=1685105477&sprefix=ba%2Caps%2C283&sr=8-8,"Simple Houseware 60-Inch Heavy Duty Garment Bag w/Pocket for Suits, Tuxedos, Dresses, Coats",$17.67,4.3 out of 5 stars,"20,080 ratings",,B07V57WL78,,Simple Houseware
https://amazon.com/Travel-Shoulder-Weekender-Overnight-Toiletry/dp/B0B4RPSNPS/ref=sr_1_9?crid=2M096C61O4MLT&keywords=bags&qid=1685105477&sprefix=ba%2Caps%2C283&sr=8-9,"Travel Duffel Bag, Sports Tote Gym Bag, Shoulder Weekender Overnight Bag for Women",$28.99,4.7 out of 5 stars,"26,635 ratings",,,,
https://amazon.com/Pack-Reusable-Grocery-Shopping-Eco-Friendly/dp/B08FRS523V/ref=sr_1_10?crid=2M096C61O4MLT&keywords=bags&qid=1685105477&sprefix=ba%2Caps%2C283&sr=8-10,"Simply Cool 50 Pack Reusable Eco-Friendly Large Grocery Shopping Bags 14.5""x14""x6.6"" Durable, Recyclable,Washable, Foldable, Portable Tote Bag (50 Pack Reusable Bags, Cream)",$27.38,4.4 out of 5 stars,815 ratings,,B08FRS523V,,Lots of Deals LLC
https://amazon.com/MUKOSEL-Merchandise-Shopping-Boutique-Reusable/dp/B08K2DM2L5/ref=sr_1_11?crid=2M096C61O4MLT&keywords=bags&qid=1685105477&sprefix=ba%2Caps%2C283&sr=8-11,"MUKOSEL 100Pcs Thank You Merchandise Bags, Extra Thick 2.36Mil 12x15In Retail Shopping Bags for Goodie bags, Party, Stores, Boutique, Clothes, Business Gift, Reusable Plastic Bags with Handle (Blacke)",$24.99,4.8 out of 5 stars,"2,211 ratings",,B08K2DM2L5,,Youcusone
https://amazon.com/Business-Merchandise-Packaging-Products-Wholesale/dp/B09ZY1SG6Y/ref=sr_1_12?crid=2M096C61O4MLT&keywords=bags&qid=1685105477&sprefix=ba%2Caps%2C283&sr=8-12,"Thank You Bags for Business Small, 100 Pack Bulk Plastic Bags for Small Business, Merchandise Bags for Packaging Products, Die Cut Shopping Bags for Small Business, Boutique Bags for Retail Wholesale (Small(9""x12""), Pink)",$16.97,4.8 out of 5 stars,204 ratings,"Our 100 Pack thank you bags for business small will safely hold merchandise and medium-sized items including apparel, books, samples, favors, handouts, toys, crafts and hobbies, and more in a convenient easy-to-carry bag. These bags feature high tensile strength and high quality 2.36 mil thickness to best protect your products and goodies.HIGH-QUALITY POLYETHYLENE is one of the most popular materials in bagging. Perfect for protecting from the air, dust, water, and bacteria, these high-quality bags are durable, affordable, and specifically designed to not easily rip, tear, wrinkle, fog, split, break, or rupture.SHOW OFF YOUR BRAND: When you need a thank you bag on hand in order to quickly package the items you need to carry or display, check out our inventory of merchandise Bags. We are committed to providing the highest quality in the industry for the best value.Thank You Bags for Boutiques are versatile and can hold a variety of items for many occasions. They are great thankyou bags for small business, small retail shops, boutiques, craft fairs, festivals, trade shows, conventions, receptions, events, parties, bridal showers, baby showers, garage sales, craft shows, birthdays, and much more! And, they can be used for many purposes such as merchandise bags, shopping bags, retail bags, reusable plastic bags, party favor bags, goody bags, shower gift bags, wedding gift bags, plastic bags with handles, boutique supplies, plastic packaging bags, vendor event supplies, product bags, merchandise bags, T-shirt bag, boutique bags for clothes, customer bags, retail shopping bags, die-cut bags, craft show supplies, convention bags, event bags, boutique accessories, craft fair supplies, and many other applications.",B09ZY1SG6Y,"Our 100 Pack thank you bags for business small will safely hold merchandise and medium-sized items including apparel, books, samples, favors, handouts, toys, crafts and hobbies, and more in a convenient easy-to-carry bag. These bags feature high tensile strength and high quality 2.36 mil thickness to best protect your products and goodies.HIGH-QUALITY POLYETHYLENE is one of the most popular materials in bagging. Perfect for protecting from the air, dust, water, and bacteria, these high-quality bags are durable, affordable, and specifically designed to not easily rip, tear, wrinkle, fog, split, break, or rupture.SHOW OFF YOUR BRAND: When you need a thank you bag on hand in order to quickly package the items you need to carry or display, check out our inventory of merchandise Bags. We are committed to providing the highest quality in the industry for the best value.Thank You Bags for Boutiques are versatile and can hold a variety of items for many occasions. They are great thankyou bags for small business, small retail shops, boutiques, craft fairs, festivals, trade shows, conventions, receptions, events, parties, bridal showers, baby showers, garage sales, craft shows, birthdays, and much more! And, they can be used for many purposes such as merchandise bags, shopping bags, retail bags, reusable plastic bags, party favor bags, goody bags, shower gift bags, wedding gift bags, plastic bags with handles, boutique supplies, plastic packaging bags, vendor event supplies, product bags, merchandise bags, T-shirt bag, boutique bags for clothes, customer bags, retail shopping bags, die-cut bags, craft show supplies, convention bags, event bags, boutique accessories, craft fair supplies, and many other applications.",
https://amazon.com/Champion-Unisex-Adults-Signal-Tote-Pink/dp/B07NCC36F3/ref=sr_1_13?crid=2M096C61O4MLT&keywords=bags&qid=1685105477&sprefix=ba%2Caps%2C283&sr=8-13,Champion Signal Tote,$16.89,4.8 out of 5 stars,"3,181 ratings","Since 1919 Champion has inspired athletes on and off the field with its authentic, American athletic apparel. From iconic Champion active wear to the latest in performance workout clothes for men, women and kids, you'll find quality sportswear for every level of play. Stow your stuff within all convenient compartments.",,"Since 1919 Champion has inspired athletes on and off the field with its authentic, American athletic apparel. From iconic Champion active wear to the latest in performance workout clothes for men, women and kids, you'll find quality sportswear for every level of play. Stow your stuff within all convenient compartments.",
https://amazon.com/Hefty-E84546CT-Strong-Kitchen-Drawstring/dp/B01G8KYP7Y/ref=sr_1_14?crid=2M096C61O4MLT&keywords=bags&qid=1685105477&sprefix=ba%2Caps%2C283&sr=8-14,"Hefty Ultra Strong Tall Kitchen Trash Bags, 13 Gallon Citrus Twist Scent, 80 Count (Pack of 1), White",$14.96,4.8 out of 5 stars,"56,782 ratings","Trust Hefty Ultra Strong Tall Kitchen Trash Bags to keep your kitchen waste contained—all the way from can to curb. Thanks to Triple-Action Technology, these tough Hefty kitchen trash bags resist punctures, leaks, and tears, providing the highest protection available in flexible garbage bags. That stretchy strength means you don't have to worry about unexpected bag breakage and inconvenient messes. Don’t be afraid to use these kitchen trash bags for tougher jobs, such as garage, basement and construction cleanup. A break-resistant grip drawstring makes it easy to close the bag and cart it away without incident. As a bonus, these scented trash bags include a patented Arm and Hammer odor neutralizer and Citrus Twist scent to keep unpleasant smells at bay. All Hefty trash bags are backed by a 100..",,"Trust Hefty Ultra Strong Tall Kitchen Trash Bags to keep your kitchen waste contained—all the way from can to curb. Thanks to Triple-Action Technology, these tough Hefty kitchen trash bags resist punctures, leaks, and tears, providing the highest protection available in flexible garbage bags. That stretchy strength means you don't have to worry about unexpected bag breakage and inconvenient messes. Don’t be afraid to use these kitchen trash bags for tougher jobs, such as garage, basement and construction cleanup. A break-resistant grip drawstring makes it easy to close the bag and cart it away without incident. As a bonus, these scented trash bags include a patented Arm and Hammer odor neutralizer and Citrus Twist scent to keep unpleasant smells at bay. All Hefty trash bags are backed by a 100..",
https://amazon.com/Reli-Thank-T-Shirt-Count-Plastic/dp/B07QQF9XP7/ref=sr_1_15?crid=2M096C61O4MLT&keywords=bags&qid=1685105477&sprefix=ba%2Caps%2C283&sr=8-15,"Reli. Thank You T-shirt Bags (350 Count) (11.5"" x 6.5"" x 21"") (White) - Grocery, Shopping Bag, Restaurants, Convenience Store",$22.28,4.7 out of 5 stars,"20,124 ratings",,,,
https://amazon.com/adidas-Defender-Medium-Duffel-Black/dp/B087LLYP7R/ref=sr_1_16?crid=2M096C61O4MLT&keywords=bags&qid=1685105477&sprefix=ba%2Caps%2C283&sr=8-16,adidas Defender 4 Medium Duffel Bag,$33.75,4.8 out of 5 stars,"5,033 ratings",Move from the street to the gym with a modern look. This newly updated duffel bag features a water-resistant base for all-day durability while you're on the go. Zip end pockets and a small front pocket give you easy access to your personal essentials.,,Move from the street to the gym with a modern look. This newly updated duffel bag features a water-resistant base for all-day durability while you're on the go. Zip end pockets and a small front pocket give you easy access to your personal essentials.,
https://amazon.com/gp/slredirect/picassoRedirect.html/ref=pa_sp_mtf_aps_sr_pg1_1?ie=UTF8&adId=A0768715H8UHF1T7OM1X&qualifier=1685105477&id=6823567326512151&widgetName=sp_mtf&url=%2FFashion-Handbags-Shoulder-Handle-Satchel%2Fdp%2FB085J1K1D8%2Fref%3Dsr_1_17_sspa%3Fcrid%3D2M096C61O4MLT%26keywords%3Dbags%26qid%3D1685105477%26sprefix%3Dba%252Caps%252C283%26sr%3D8-17-spons%26psc%3D1,Women Fashion Handbags Wallet Tote Bag Shoulder Bag Top Handle Satchel Purse Set 4pcs,$31.19,4.4 out of 5 stars,"35,347 ratings",,,,
https://amazon.com/gp/slredirect/picassoRedirect.html/ref=pa_sp_mtf_aps_sr_pg1_1?ie=UTF8&adId=A0659917HDRZYVWDY7KF&qualifier=1685105477&id=6823567326512151&widgetName=sp_mtf&url=%2FDrawstring-Backpack-Black-Nylon-String%2Fdp%2FB0B1T8QT38%2Fref%3Dsr_1_18_sspa%3Fcrid%3D2M096C61O4MLT%26keywords%3Dbags%26qid%3D1685105477%26sprefix%3Dba%252Caps%252C283%26sr%3D8-18-spons%26psc%3D1,CAIHONG 100 Pack Drawstring Backpack Black Bulk Drawstring Bags Nylon String Backpack Gym Cinch Sack Backpack Sport Bag Draw String Party Bags for Men or Women,$68.99,4.7 out of 5 stars,99 ratings,,B0B1T8QT38,,CAIHONG
https://amazon.com/gp/slredirect/picassoRedirect.html/ref=pa_sp_mtf_aps_sr_pg1_1?ie=UTF8&adId=A0702132DVQ1UIQIWVU8&qualifier=1685105477&id=6823567326512151&widgetName=sp_mtf&url=%2FBrown-8x4-5x10-8-100Pcs-Handles-Retail%2Fdp%2FB09DSCK7PC%2Fref%3Dsr_1_19_sspa%3Fcrid%3D2M096C61O4MLT%26keywords%3Dbags%26qid%3D1685105477%26sprefix%3Dba%252Caps%252C283%26sr%3D8-19-spons%26psc%3D1%26smid%3DA1EPQ3W76BWAS3,"RACETOP Brown Paper Bags with Handles Bulk 100Pcs 8x4.5x10.8 Inch Gift Bags, Brown Kraft Paper Bags, Gift Bags Bulk, Retail Bags, Party Bags, Shopping Bags, Favor Bags",$23.99,4.6 out of 5 stars,360 ratings,,B09DSCK7PC,,Racetop
https://amazon.com/gp/slredirect/picassoRedirect.html/ref=pa_sp_mtf_aps_sr_pg1_1?ie=UTF8&adId=A01234883DHBAETEO216I&qualifier=1685105477&id=6823567326512151&widgetName=sp_mtf&url=%2FPack-Reusable-Grocery-Shopping-Eco-Friendly%2Fdp%2FB08FRS523V%2Fref%3Dsr_1_20_sspa%3Fcrid%3D2M096C61O4MLT%26keywords%3Dbags%26qid%3D1685105477%26sprefix%3Dba%252Caps%252C283%26sr%3D8-20-spons%26psc%3D1,"Simply Cool 50 Pack Reusable Eco-Friendly Large Grocery Shopping Bags 14.5""x14""x6.6"" Durable, Recyclable,Washable, Foldable, Portable Tote Bag (50 Pack Reusable Bags, Cream)",$27.38,4.4 out of 5 stars,815 ratings,,B08FRS523V,,Lots of Deals LLC
https://amazon.com/GUTGNK-Cosmetic-organizer-Aesthetic-Corduroy/dp/B0BYXP5M8R/ref=sr_1_21?crid=2M096C61O4MLT&keywords=bags&qid=1685105477&sprefix=ba%2Caps%2C283&sr=8-21,"GUTGNK Cosmetic bags for women, Cute Smile Face makeup bag, travel makeup bag small makeup bag for purse organizer makeup organizer Aesthetic Stuff,Corduroy make up bag with Zipper - Beige",$5.99,4.9 out of 5 stars,209 ratings,,B0BYXP5M8R,,GUTGNK
https://amazon.com/Michael-Kors-Womens-Crossbody-hardware/dp/B0B9CC5D5Q/ref=sr_1_22?crid=2M096C61O4MLT&keywords=bags&qid=1685105477&sprefix=ba%2Caps%2C283&sr=8-22,Michael Kors Women's Jet Set Item Lg Crossbody,$84.00,4.8 out of 5 stars,"3,055 ratings","Michael Kors Women's Jet Set Item East West Crossbody Bag Top-Zip Fastening, Lining: 100% Polyester and two interior 2 Slit Pockets Adjustable Chain and Leather shoulder strap of 25.5 Inches Approximate Drop Approximate Measurements: Length: 9.5 x Height: 6.25 x Width: 2 Inches Dust bag not included",,"Michael Kors Women's Jet Set Item East West Crossbody Bag Top-Zip Fastening, Lining: 100% Polyester and two interior 2 Slit Pockets Adjustable Chain and Leather shoulder strap of 25.5 Inches Approximate Drop Approximate Measurements: Length: 9.5 x Height: 6.25 x Width: 2 Inches Dust bag not included",
https://amazon.com/DALINDA-Lunch-Bag-Reusable-Insulated/dp/B0B5KSY2MF/ref=sr_1_23?crid=2M096C61O4MLT&keywords=bags&qid=1685105477&sprefix=ba%2Caps%2C283&sr=8-23,"DALINDA Lunch Bag Lunch Box for Women Men Reusable Insulated Lunch Tote Bag,Leakproof Thermal Cooler Sack Food Handbags Case High Capacity forTravel Work School Picnic- Black",$6.47,4.6 out of 5 stars,"1,887 ratings",,B0B5KSY2MF,,DALINDA
https://amazon.com/Moretoes-Assorted-Business-Shopping-Merchandise/dp/B0B7X3GMF9/ref=sr_1_24?crid=2M096C61O4MLT&keywords=bags&qid=1685105477&sprefix=ba%2Caps%2C283&sr=8-24,"Moretoes 150pcs Brown Paper Bags with Handles Assorted Sizes Gift Bags Bulk, Kraft Paper Bags for Small Business, Shopping Bags, Retail Bags, Party Bags, Merchandise Bags, Favor Bags",$45.99,4.8 out of 5 stars,69 ratings,,B0B7X3GMF9,,
https://amazon.com/gp/slredirect/picassoRedirect.html/ref=pa_sp_mtf_aps_sr_pg1_1?ie=UTF8&adId=A08599253I9H7DGOUD1M1&qualifier=1685105477&id=6823567326512151&widgetName=sp_mtf&url=%2F2Mil-Clear-Reclosable-Lock-Bags%2Fdp%2FB01A09SKNY%2Fref%3Dsr_1_25_sspa%3Fcrid%3D2M096C61O4MLT%26keywords%3Dbags%26qid%3D1685105477%26sprefix%3Dba%252Caps%252C283%26sr%3D8-25-spons%26psc%3D1,"Clear Plastic Reusable Zip Bags - Bulk GPI Case of 1000 3"" x 4"" 2 mil Thick Strong & Durable Poly Baggies with Resealable Zip Top Lock for Travel, Storage, Packaging & Shipping.",$16.59,4.8 out of 5 stars,"2,880 ratings",,,,
https://amazon.com/gp/slredirect/picassoRedirect.html/ref=pa_sp_mtf_aps_sr_pg1_1?ie=UTF8&adId=A08979723QNTBBUQWPB29&qualifier=1685105477&id=6823567326512151&widgetName=sp_mtf&url=%2FNPBAG-Natural-Cotton-Teflon-5-Pack%2Fdp%2FB08MXNGX4X%2Fref%3Dsr_1_26_sspa%3Fcrid%3D2M096C61O4MLT%26keywords%3Dbags%26qid%3D1685105477%26sprefix%3Dba%252Caps%252C283%26sr%3D8-26-spons%26psc%3D1,"NPBAG 5 | 15 | 25 | 50 Pack 15'' X 16'' Natural Cotton Tote Bags, Lightweight Blank Bulk Cloth bags with 1pc of PTFE Teflon Sheet (5-Pack)",$11.99,4.4 out of 5 stars,"1,510 ratings",,B08MXNGX4X,,NPBAG
https://amazon.com/gp/slredirect/picassoRedirect.html/ref=pa_sp_mtf_aps_sr_pg1_1?ie=UTF8&adId=A0335642335W36RE4A4HH&qualifier=1685105477&id=6823567326512151&widgetName=sp_mtf&url=%2F1000-Count-Reclosable-Resealable-Industrial%2Fdp%2FB07C4VF3QS%2Fref%3Dsr_1_27_sspa%3Fcrid%3D2M096C61O4MLT%26keywords%3Dbags%26qid%3D1685105477%26sprefix%3Dba%252Caps%252C283%26sr%3D8-27-spons%26psc%3D1,Spartan Industrial - 5” X 7” (1000 Count) 2 Mil Clear Reclosable Zip Plastic Poly Bags with Resealable Lock Seal Zipper,$31.88,4.7 out of 5 stars,"1,881 ratings","The 5 X 7 reclosable poly bags are perfect to use for packaging or packing merchandise. The 5x7 zip bags can be used for herbs, small parts, shipping, handmade goods, soaps, and cards. The reclosable clear poly bags have a very reliable zipper. The seal is strong and the lock is secure. Using these resealable bags not only will save you time but also money! The plastic bag is made of high quality virgin LDPE - it is pliable and incredibly easy to use.",B07C4VF3QS,"The 5 X 7 reclosable poly bags are perfect to use for packaging or packing merchandise. The 5x7 zip bags can be used for herbs, small parts, shipping, handmade goods, soaps, and cards. The reclosable clear poly bags have a very reliable zipper. The seal is strong and the lock is secure. Using these resealable bags not only will save you time but also money! The plastic bag is made of high quality virgin LDPE - it is pliable and incredibly easy to use.",ATZ Premium Brands
https://amazon.com/gp/slredirect/picassoRedirect.html/ref=pa_sp_mtf_aps_sr_pg1_1?ie=UTF8&adId=A07746153UE1IHP6CU2Q7&qualifier=1685105477&id=6823567326512151&widgetName=sp_mtf&url=%2FMoretoes-Shopping-Business-Birthday-Merchandise%2Fdp%2FB0BNN9PD8J%2Fref%3Dsr_1_28_sspa%3Fcrid%3D2M096C61O4MLT%26keywords%3Dbags%26qid%3D1685105477%26sprefix%3Dba%252Caps%252C283%26sr%3D8-28-spons%26psc%3D1,"Moretoes 90pcs Paper Gift Bags 10x5x13 Inches White Kraft Paper Bags with Handles Bulk, Shopping Bags, Retail Bags for Small Business, Birthday Wedding Party Favor Bags, Merchandise Bags",$25.99,4.9 out of 5 stars,10 ratings,,B0BNN9PD8J,,
https://amazon.com/TOPDesign-Economical-Lightweight-Advertising-Promotion/dp/B082D538WG/ref=sr_1_29?crid=2M096C61O4MLT&keywords=bags&qid=1685105477&sprefix=ba%2Caps%2C283&sr=8-29,"TOPDesign 5 | 12 | 24 | 48 | 192 Pack Economical Cotton Tote Bag, Lightweight Medium Reusable Grocery Shopping Cloth Bags, Suitable for DIY, Advertising, Promotion, Gift, Activity (5-Pack)",$16.99,4.5 out of 5 stars,"10,523 ratings",,B082D538WG,,
https://amazon.com/Purple-Business-1-5Mil-Merchandise-Glossy/dp/B01MRZJIFX/ref=sr_1_30?crid=2M096C61O4MLT&keywords=bags&qid=1685105477&sprefix=ba%2Caps%2C283&sr=8-30,"200 Pink & Purple Bags for Small Business 100 Pink and 100 Purple 1.5Mil 9""x12"" Merchandise Bags Thick Glossy Retail Bags and Shopping Bags For Small Business with Die Cut Handles Boutique Bags",$19.99,4.7 out of 5 stars,"4,572 ratings",,,,
https://amazon.com/NORTH-FACE-Jester-Crossbody-Skylight/dp/B0BH99P278/ref=sr_1_31?crid=2M096C61O4MLT&keywords=bags&qid=1685105477&sprefix=ba%2Caps%2C283&sr=8-31,"THE NORTH FACE Jester Crossbody Bag, Skylight Blue/TNF Black, One Size",$34.97,4.6 out of 5 stars,811 ratings,,B0BH99P278,,The North Face
https://amazon.com/SpaceAid-Storage-Compression-Comforters-Blankets/dp/B0BM92QM48/ref=sr_1_32?crid=2M096C61O4MLT&keywords=bags&qid=1685105477&sprefix=ba%2Caps%2C283&sr=8-32,"SpaceAid Jumbo Vacuum Storage Bags, Space Saver Sealer Compression Bags for Comforters, Blankets, Pillows, Bedding, Clothes (X-Large 3 Pack)",$18.99,4.5 out of 5 stars,50 ratings,"Create Space: Squeeze and compress the air out of your bulky or seasonal belongings to compact and modular storage in wardrobes, closets, cupboards, suitcases, or under beds",B0BM92QM48,"Create Space: Squeeze and compress the air out of your bulky or seasonal belongings to compact and modular storage in wardrobes, closets, cupboards, suitcases, or under beds",
https://amazon.com/gp/slredirect/picassoRedirect.html/ref=pa_sp_mtf_aps_sr_pg1_1?ie=UTF8&adId=A050534738LG1GFBAD93O&qualifier=1685105477&id=6823567326512151&widgetName=sp_mtf&url=%2FReli-Biodegradable-Thank-Bags-Count%2Fdp%2FB08WPNNQGW%2Fref%3Dsr_1_33_sspa%3Fcrid%3D2M096C61O4MLT%26keywords%3Dbags%26qid%3D1685105477%26sprefix%3Dba%252Caps%252C283%26sr%3D8-33-spons%26psc%3D1,"Reli. Biodegradable Thank You Bags | 550 Count - Bulk | Made in USA | Biodegradable Shopping Bags, Grocery Bags/Restaurant | OxoBiodegradable Plastic Bags | 11.5"" x 6.5"" x 22"" | Green T-Shirt Bags",$42.99,4.6 out of 5 stars,313 ratings,,,,
https://amazon.com/gp/slredirect/picassoRedirect.html/ref=pa_sp_mtf_aps_sr_pg1_1?ie=UTF8&adId=A00092253EJWE6SXJDBSS&qualifier=1685105477&id=6823567326512151&widgetName=sp_mtf&url=%2FJERIA-Reusable-Foldable-Shopping-Reinforced%2Fdp%2FB0983F8MHZ%2Fref%3Dsr_1_34_sspa%3Fcrid%3D2M096C61O4MLT%26keywords%3Dbags%26qid%3D1685105477%26sprefix%3Dba%252Caps%252C283%26sr%3D8-34-spons%26psc%3D1,JERIA 24-Pack Reusable Grocery Bags，Large Washable Foldable Shopping Bags，Heavy Duty Tote Bags with Reinforced Handles,$29.99,4.6 out of 5 stars,666 ratings,,,,
https://amazon.com/gp/slredirect/picassoRedirect.html/ref=pa_sp_mtf_aps_sr_pg1_1?ie=UTF8&adId=A1009151SY5YH0UJVZL4&qualifier=1685105477&id=6823567326512151&widgetName=sp_mtf&url=%2FCOGLARING-6-3x3-2x8-3-Thickened-Birthday-Shopping%2Fdp%2FB0BDR895Z5%2Fref%3Dsr_1_35_sspa%3Fcrid%3D2M096C61O4MLT%26keywords%3Dbags%26qid%3D1685105477%26sprefix%3Dba%252Caps%252C283%26sr%3D8-35-spons%26psc%3D1,COGLARING 100Pcs 6.3x3.2x8.3 Gift Bags Kraft Paper Bag w/Handles Bulk Shopping Favor Bags,$21.99,4.5 out of 5 stars,35 ratings,,B0BDR895Z5,,
https://amazon.com/Rockland-Luggage-Rolling-Duffle-Black/dp/B000SRL6TY/ref=sr_1_36?crid=2M096C61O4MLT&keywords=bags&qid=1685105477&sprefix=ba%2Caps%2C283&sr=8-36,"Rockland Rolling Duffel Bag, Black, 22-Inch",$33.29,4.2 out of 5 stars,"17,382 ratings","Travel in style with this great soft-sided rolling duffle bag. Bag features a heavy duty polyester construction. Inline skate wheels for superior mobility, internal retractable hide-away handle system, u-top opening provides easy access to roomy zipper secured main compartment. Two front zipper-secured compartments, adjustable ergonomic shoulder strap. Made of 600 denier heavy duty polyester. Measures 22"" L x 12"" W x 11"" H",B000SRL6TY,"Travel in style with this great soft-sided rolling duffle bag. Bag features a heavy duty polyester construction. Inline skate wheels for superior mobility, internal retractable hide-away handle system, u-top opening provides easy access to roomy zipper secured main compartment. Two front zipper-secured compartments, adjustable ergonomic shoulder strap. Made of 600 denier heavy duty polyester. Measures 22"" L x 12"" W x 11"" H",Fox Luggage
https://amazon.com/EASYFUN-Lightweight-Crossbody-Backpack-Traveling/dp/B0BWRP49TL/ref=sr_1_37?crid=2M096C61O4MLT&keywords=bags&qid=1685105477&sprefix=ba%2Caps%2C283&sr=8-37,EASYFUN Sling Bag Lightweight Crossbody Sling Backpack for Women Men Large Shoulder Chest Bag Daypack for Hiking Traveling,$10.99,5.0 out of 5 stars,8 ratings,,B0BWRP49TL,,
